Mike Mayo,"Analyst, Wells Fargo Securities LLC","Hi. I understand the NII strategy benefited from First Republic, asset sensitivity, CD strategy, money in motion, and I'm curious to how much is the NII increase and the deposit benefits a function of the 67 million digital banking customers? Do you have more digital banking customers than branch customers now? If you can just refresh that. And then a more general question. I guess I have the first one for Jeremy and the second one for Jamie. You have record tech spend. What's the benefit of having record tech spend, if you can kind of mark-to-market your thoughts there as it relates to AI, as it relates to maybe wasted spending, your outlook for next year? And does it really help to be the biggest tech spender in the banking industry? As it relates to AI specifically, which is the talk of the town, I guess the consensus among people outside the banking industry is that banks will not win that battle, including JPMorgan. You won't control the front end. What are you doing with AI to make a difference now, or is this just simply a moonshot? And then lastly, I think you had made a mention at a conference about investment spend or tech spend over the next year. Where do you stand on that? All right. Thank you.",Jeremy Barnum,"Chief Financial Officer, JPMorgan Chase & Co.","Yes. Let me do digital banking, Mike. I spent some time on this actually a couple weeks ago. And it's interesting to note this sort of extent to which the growth in digitally engaged consumers is higher than the overall growth in consumer accounts, meaning that we're continuing to increase the percentage of our consumers that are digitally engaged. And it sort of goes back to my prior point... For sure. For sure. Which actually links to the broader point that what – in terms of your question about how much is this helping the current NII story, it goes to the larger point of it holistic through the cycle, multichannel, fully engaged customer strategy which requires a lot of investment in branches, obviously, but also in digital services of all sorts. So in many ways, you can see the current environment as a little bit of a payoff of that investment. But that's not like, therefore, we stop investing, obviously. So I guess that's part of the answer. And I guess your other question is the benefits of being the biggest tech spender. I just think like it's sort of mandatory, right? I mean we're big and it's a very technology-centric business, and the world is competitive, and everything is changing. Younger generations have different expectations, and we have to be nimble, and we have to be on our front foot. And otherwise, we risk getting severely disrupted. So I don't know if Jamie wants to add anything. Yeah. Now because you did ask a little bit about the expense outlook for next year. So I think at the conference we said, I think the consensus was $88 billion, but we're still going through the budget process, et cetera, et cetera. So that's still true. I think we're still kind of in the ballpark, but I would say at the margin there's going to be a little bit of upward pressure. Yeah, this is all now including First Republic. And I think there will be a little bit of upward pressure on that as we sort of do our usual thing and look at all of the opportunities that we see and the investments that we want to make. So no surprise in that sense that we're going to invest prudently. Nothing dramatic, but probably a little bit of upward pressure at the margin."
Jim Mitchell,"Analyst, Seaport Global Securities LLC","Hey. Good morning. Jeremy, do you think there's any receptivity among regulators regarding the double counting not only of operational risk but I think you alluded to this earlier in the Markets business, but there's clearly double counting in market risk in the trading book. Is there any receptivity?
Okay. And then if it weren't to change, and you talked about the potential negative impact on liquidity in the Markets business specifically, is that a JPM pulling out of certain businesses type event? Or is it more a comment that there'd be fewer providers of liquidity as less scaled players exit, and maybe that's almost equal a market share gain opportunity for JPMorgan in a smaller business?
Right. That's helpful. Thanks.",Jamie Dimon,"Chairman & Chief Executive Officer, JPMorgan Chase & Co.","Can I just answer that real quickly? We don't really know. It's a one-sided conversation generally. They say put it in your comments, so everyone is going to put in extensive comments, kind of like you heard from Jeremy and we don't really know. We don't really know what's going on inside the Fed, how many people get involved. In my view, it's become a very politicized process as opposed to the technical analysis I think is required to do it exactly right. So we'll see.
I think so if you look at Markets alone, it's a huge, I think 60%, increase in capital. And if you look at it, you can do that by product. For some products it's worse than for others, but generally it's bad across all products. But the really important thing is market making is a critical function and if you look at the world, only some of these large market makers who could make markets for governments, hospitals, cities, schools, states, IMF, World Bank, BlackRock, Blackstone, and all those various things who buy and sell for their clients in size. And market makers have a different function than hedge funds, and I don't know what the real intent was with this. This is another one I think that needs to be really thought through with what are you trying to accomplish.
We do market making quite safe. We've never lost the kind of money that people talk about in market making in the global market shock or something like that, but the other thing about market making, I do agree, it could actually force some people out. It will force lower positions which is why I think it's a little risky, but it may also force more consolidation. And so clients, since they need it so much, there may be consolidation in an unintended way in market making and obviously more volatile markets because with all the constraints, with the LCR, SLR, capital, etc., you will constantly be up against limitations in what you can do.
Great opportunity for European market makers. I mean, a great opportunity, like they can do repo and FX and swaps and credit and stuff with 30% less capital. That is a big difference in that kind of business."
Matt O'Connor,"Analyst, Deutsche Bank Securities, Inc.","Hi, good morning. You talked about increased investment spend in some areas in response to an earlier question. But just how do you think about cost control overall, looking at the medium term? The outlook for revenue is obviously pressured at least on net interest income. Fees might help, but the backdrop is for potentially declining revenue or at least flattish revenue for a couple or few years. So, I know you always say you want to invest for the cycle, and it's really paid off over time, but how are you thinking about cost control the next few years? Yeah. Fair enough. And if I could just squeeze in on First Republic, obviously the contribution there is coming in multiples higher-than-expected. How do you think about the puts and takes in terms of, I think there's probably some run-off of loans still to come, but also opportunities to deepen the relationships there? Okay. Thank you very much.",Jeremy Barnum,"Chief Financial Officer, JPMorgan Chase & Co.","Yeah. I mean, I wish I had sort of an answer that fit better into your framework. But in some fundamental sense, we just kind of don't agree with the framework in the sense that and we've been through this over the last couple of years, right? In a world where rates drop very suddenly and recover like quite dramatically, and credit becomes abnormally good and then rebounds, and you've seen these very significant fluctuations in capital markets. We saw that in 2021 going into 2022 where the revenue environment can change a lot in the short term for reasons that can be largely out of your control. And while of course there are parts of our expense base, which are in the short term directly sensitive to the revenue environment and some of those adjust naturally and some of them we adjust more forcefully as a function of volumes, but other things are much more structural. And the goal is to make sure that those other things are sized appropriately to what we believe sustainable through the cycle returns are. So we're always very focused on cost. You can be rest assured of that. That discipline internally is as aggressive as ever as we go through the budget cycle. But there are long-term plays and you really shouldn’t expect us to see trying to generate cosmetically lower costs in response to a lower revenue environment where we didn’t balloon the costs when the revenue became as we’ve argued unsustainably high. Yeah. So you're right about the contribution and about the run-off of loans, and it is notable the First Republic related net income that we've printed this quarter – so the first thing to say is that we don't think that that First Republic related net income number from this quarter is a sustainable indicator of the future run rate. Some of the same dynamics that we've just talked about, in particular, over-earning on deposits or sort of above normal on deposit margins, also apply to the First Republic franchise to some degree. So we would expect that to normalize. And probably more significantly as the things you alluded to, we do have some accelerated pull to par on some of the commitments that we took on at a fair value discount as part of the acquisition, so that's a short-term tailwind in the revenue that will come out of that over the next few quarters. And yeah, in terms of how it's going overall and deepening the relationships, that remains a focus and I think more of that will happen as we continue the integration and we continue stabilizing. And yeah, I think as I said on the press call, things are going well arguably a little bit better than we'd sort of modeled as part of the acquisition, and we're happy to see that."
Jamie Dimon,"Chairman & Chief Executive Officer, JPMorgan Chase & Co.",Thank you very much.,,,Thank you. There are no further questions.
