57,1Q24,Do you feel like you're under-earning on the Investment Banking side?,['feel like under-earning investment banking side'],Glenn Schorr,"Analyst, Evercore ISI","Yeah, Glenn. In short, yes. I mean, I think we're not shy about saying that we're under-earning in Investment Banking right now. Clearly, we're below cycle averages, as you point out. We've been talking about when do we get back to the pre-pandemic wallet? But as you know, I mean on this point, what it was, like March 2020, right, was the beginning of the pandemic. So, it's like four years ago at this point. So, there has been GDP growth, especially in nominal terms during that period, and you would expect the wallet to growth with that. So, I do think there's meaningful upside in the Investment Banking fee wallet. As I've noted, there are some headwinds, I think particularly in M&A. But over time, you would hope that the amount of M&A is a function of the underlying industrial logic rather than the regulatory environment. So, you could see some mean reversion there. And, yeah, so that's why we're sort of leaning in. We're engaging with clients. We're making sure that we're appropriately resourced for a more robust level of the wallet and fighting for every dollar of share.",['yeah glenn short yes mean think were shy saying were under-earning investment banking right now clearly were cycle averages point out weve talking get back pre-pandemic wallet know mean point was like march 2020 right beginning pandemic so like four years ago point so gdp growth especially nominal terms period would expect wallet growth that so think theres meaningful upside investment banking fee wallet ive noted headwinds think particularly m&a time would hope amount m&a function underlying industrial logic rather regulatory environment so could see mean reversion there and yeah thats were sort leaning in were engaging clients were making sure were appropriately resourced robust level wallet fighting every dollar share'],Jeremy Barnum,"Chief Financial Officer, JPMorgan Chase & Co."
58,1Q24,"Good morning. You mentioned one use of capital is to lean into the trading businesses with your balance sheet. And we just see the trading assets going up Q2, which is probably seasonal, but also up a lot year-over-year, but not necessarily translate into higher revenues. And I know they don't like match up necessarily each quarter, but maybe just elaborate like how you're leaning into the trading with the balance sheet and how you expect that to benefit you over time.",['good morning mentioned one use capital lean trading businesses balance sheet see trading assets going q2 probably seasonal also lot year-over-year necessarily translate higher revenues know like match necessarily quarter maybe elaborate like leaning trading balance sheet expect benefit time'],Matt O’Connor,"Analyst, Deutsche Bank Securities, Inc.","Yeah, sure. So, let me break this question down into a couple of different parts. So, I think what Jamie was sort of suggesting is that, you can think of the concept as kind of like strategic capital versus tactical capital for lack of a better term. And what he's kind of saying is that, in a moment where you're carrying a lot of excess capital sort of for strategic reasons, you have the ability at least in theory to deploy portions of that with kind of like – into relatively short-duration assets or strategies or client opportunities in whatever moment for whatever reason, and what might be thought of as a tactical sense. So, he's just pointing out that that's an option that you have. And the extent to which this quarter's increase in Markets RWA is a reflection of that, maybe a little bit, but probably not. I agree with you that it's hard in any given quarter to specifically link the change in capital and RWA to a change in revenue versus too many moving parts there. But for sure, one thing that's true is the higher run rate of the Markets businesses as a whole that we talked about a second ago, is linked also to higher deployment of balance sheet into those businesses. So, as you well know, we pride ourselves on being extremely analytical and extremely disciplined in how we analyze capital liquidity, balance sheet deployment, GSIB capacity utilization, et cetera, in the Markets business. And we don't just chase revenue; we go after returns fully measured. And that's part of the DNA, and we continue to do it and we will. So – that we still are operating under multiple binding constraints. And obviously, the environment is complex, so the ability to sort of throw a ton of capital at opportunities is not quite that simple always. But big picture, we are clearly in a very, very strong capital position which is, in no small part in anticipation of all the uncertainty, but it does also mean that if opportunities arise between now and when the Basel III Endgame is final, we are very well positioned to take advantage of those opportunities.",['yeah sure so let break question couple different parts so think jamie sort suggesting that think concept kind like strategic capital versus tactical capital lack better term hes kind saying that moment carrying lot excess capital sort strategic reasons ability least theory deploy portions kind like – relatively short-duration assets strategies client opportunities whatever moment whatever reason might thought tactical sense so hes pointing thats option have extent quarters increase markets rwa reflection that maybe little bit probably not agree hard given quarter specifically link change capital rwa change revenue versus many moving parts there sure one thing thats true higher run rate markets businesses whole talked second ago linked also higher deployment balance sheet businesses so well know pride extremely analytical extremely disciplined analyze capital liquidity balance sheet deployment gsib capacity utilization et cetera markets business chase revenue; go returns fully measured thats part dna continue will – still operating multiple binding constraints obviously environment complex ability sort throw ton capital opportunities quite simple always big picture clearly very strong capital position is small part anticipation uncertainty also mean opportunities arise basel iii endgame final well positioned take advantage opportunities'],Jeremy Barnum,"Chief Financial Officer, JPMorgan Chase & Co."
59,1Q24,"Can you share with us the color on what's going on in the corporate lending market in terms of spreads seem to be getting tighter? It's not reflecting, I don't think, a real fear out there in the global geopolitical world. And any color just on what you guys are seeing in the leveraged loan market as well?",['share us color whats going corporate lending market terms spreads seem getting tighter reflecting think real fear global geopolitical world color guys seeing leveraged loan market well'],Gerard Cassidy,"Analyst, RBC Capital Markets LLC","Right. So, I think what's true about spreads in general, just broadly credit spreads including secondary markets and to some extent the leverage lending space, is that they are exceptionally tight. So, I'm sure that's reversed a little bit in the last few days. But broadly throughout the quarter, we've really seen credit spreads tighten quite a bit. You even see that a little bit in our OCI this quarter, where losses in OCI that we would've had from higher rates have been meaningfully offset by tighter credit spreads in the portfolio. So broadly, sort of in keeping with the big run-up that we saw in equity markets and the general sort of bullish tone, you saw quite a bit of credit spread tightening in secondary markets. That, I think, has manifested itself a little bit in the leverage lending space in the normal way that it does, and that there's a lot of competition among providers for the revenue pool, and you start to see a little bit of loosening of terms which always makes us a little bit concerned. And as we have in the past, we are going to be very well prepared to lose share in that space if we don't like the terms. We never compromise on structure there. So, you are seeing a little bit of that. I think that, away from the leverage lending space in the broader C&I space, there was a moment a few months ago where I think, in no small part, as a result of banks generally anticipating this more challenging capital environment and sort of disciplining a little bit their lending, you're seeing a little bit of widening actually in those corporate lending spreads. I don't know if that trend has like survived over the last few weeks, and it was little bit hard to observe in any case. But I would say broadly, the dynamics are the tension between people trying to be careful with their balance sheets and the fact that overall asset prices and conditions are quite supportive and secondary market credit spreads have rallied a lot.",['right so think whats true spreads general broadly credit spreads including secondary markets extent leverage lending space exceptionally tight so im sure thats reversed little bit last days broadly throughout quarter weve really seen credit spreads tighten quite bit even see little bit oci quarter losses oci wouldve higher rates meaningfully offset tighter credit spreads portfolio broadly sort keeping big run-up saw equity markets general sort bullish tone saw quite bit credit spread tightening secondary markets that think manifested little bit leverage lending space normal way does theres lot competition among providers revenue pool start see little bit loosening terms always makes us little bit concerned past going well prepared lose share space like terms never compromise structure there so seeing little bit that think that away leverage lending space broader c&i space moment months ago think small part result banks generally anticipating challenging capital environment sort disciplining little bit lending seeing little bit widening actually corporate lending spreads know trend like survived last weeks little bit hard observe case would say broadly dynamics tension people trying careful balance sheets fact overall asset prices conditions quite supportive secondary market credit spreads rallied lot'],Jeremy Barnum,"Chief Financial Officer, JPMorgan Chase & Co."
60,1Q24,"As a quick follow-up. Where are the next homeruns going to come from? And this is more strategic beyond just JPMorgan, but there are probably going to be more regional bank failures, whether it's this year or next year, and opportunities to pick those up. But what you're seeing is that, private equity and family offices are setting up to participate in this next round of bank failures. Mnuchin's buying of NYCB is clearly to create a platform for rollups of failed banks, and then there are other family offices that have filed shelf registrations for bank holding companies whose specific purpose is to buy failed banks. So, do you think that these opportunities are going to be competed away by private credit? And as part of that, do you think the regulators are going to view private credit as a different party and less attractive party versus bank takeovers of failed banks? So, that's my question.",['quick follow-up next homeruns going come from strategic beyond jpmorgan probably going regional bank failures whether year next year opportunities pick up seeing that private equity family offices setting participate next round bank failures mnuchins buying nycb clearly create platform rollups failed banks family offices filed shelf registrations bank holding companies whose specific purpose buy failed banks so think opportunities going competed away private credit part that think regulators going view private credit different party less attractive party versus bank takeovers failed banks so thats question'],Charles W. Peabody,"Analyst, Portales Partners LLC","Right. Okay, Charlie. There's a lot in there. And to be honest, I just don't love the idea of spending a lot of time on this call speculating about bank failures. You obviously have a particular view about the next wave in the landscape. I'm not going to bother debating that with you. But I guess, let me just try to say a couple of things, doing my best to answer your question. As we talked about earlier, we have a lot of capital. And as Jamie says, the capital is earnings in store, and right now we don't see a lot of really compelling opportunities to deploy the capital. But if opportunities arise despite the uncertainty about the Basel III Endgame, we will be well positioned to deploy it. I think embedded there is also sort of a question about the FDIC and the FDIC's attitude towards different types of bidders, and obviously there's a lot of thinking and analysis happening about the entire process and some recent forums and speeches on bank resolution and so on and so forth. And I think probably we can all agree that it's better, all else equal for the system, to have as much capital available and as many different types of capital available to ensure that things are stabilized if anything ever goes wrong. But the mechanics of how you do that when you're talking about banks are not trivial and not to be underestimated. So I guess, that's probably as much as I have on that.",['right okay charlie theres lot there honest love idea spending lot time call speculating bank failures obviously particular view next wave landscape im going bother debating you guess let try say couple things best answer question talked earlier lot capital jamie says capital earnings store right see lot really compelling opportunities deploy capital opportunities arise despite uncertainty basel iii endgame well positioned deploy it think embedded also sort question fdic fdics attitude towards different types bidders obviously theres lot thinking analysis happening entire process recent forums speeches bank resolution forth think probably agree better else equal system much capital available many different types capital available ensure things stabilized anything ever goes wrong mechanics talking banks trivial underestimated guess thats probably much that'],Jeremy Barnum,"Chief Financial Officer, JPMorgan Chase & Co."
61,2Q24,"So, wanted to start off with a question on capital just given some indications that the Fed is considering favorable revisions to both Basel III Endgame and the GSIB surcharge calculations, which I know you've been pushing for some time. As you evaluate just different capital scenarios, are these revisions material enough where they could support a higher normalized ROTCE at the Firm versus the 17% target? And if so, just how that might impact or inform your appetite for buybacks going forward?",['so wanted start question capital given indications fed considering favorable revisions basel iii endgame gsib surcharge calculations know pushing time evaluate different capital scenarios revisions material enough could support higher normalized rotce firm versus 17% target so might impact inform appetite buybacks going forward'],Steven Chubak,"Analyst, Wolfe Research LLC","Right. Okay. Thanks, Steve. And actually, before answering the question, I just want to remind everyone that Jamie is not able to join because he has a travel conflict overseas, so it's just going to be me today. Okay. Good question on the capital and the ROTCE. So, let me start with the ROTCE point first. In short, my answer to that question would be no. It's hard to imagine a scenario coming out of the whole potential range of outcomes on capital that involves an upward revision on ROTCE. If you think about the way we've been talking about this, we've said that before the Basel III Endgame proposal, we had a 17% through the cycle target, and that while you can imagine a range of different outcomes, the vast majority of them involve expansions of the denominator. And while we had ideas about changing the perimeter and repricing, all of which are still sort of in effect, most of those would be thought of as mitigants rather than things that would actually, like increase the ROTCE. And I don't really think that answer has particularly changed. So, as of now, that's what I would say, which is a good pivot to the next point, which is, yeah, we've been reading the same press coverage you've been reading and it's fun and interesting to speculate about the potential outcomes here. But in reality, we don't know anything you don't know. We don't know how reliable the press coverage is. And so, in that sense, I feel like on the overall capital return and buyback trajectory, not much has actually changed relative to what I laid out at Investor Day, the comments that I made then, the comments that Jamie made then, as well as the comments that Jamie made the subsequent week at an industry conference. So, maybe I'll just briefly summarize for everyone's benefit what we think that is, which is, one, we do recognize that our current practice on capital return and buybacks does lead to an ever-expanding CET1 ratio. But obviously, we're going to run the company over the cycle over time at a reasonable CET1 ratio with reasonable buffers relative to our requirement. So, after all the uncertainty is sorted out, the question of the deployment of the capital, one way or another, is a matter of when, not if. On the capital hierarchy, it's also worth noting that's another thing that remains unchanged, so I'll review it quickly. Growing the business organically and inorganically, sustainable dividend, and in that context it's worth noting that the board's announced intention to increase it to $1.25 is a 19% increase prior to last year. So, that's a testament to our performance and that is a return of capital. And then, finally buybacks. But that hierarchy does not commit us to return 100% of the capital generation in any given quarter. And so, as we sit here today, when you look at the relationship between the opportunity cost of not deploying the capital and the opportunities to deploy the capital outside the Firm, it's kind of hard to imagine an environment where that relationship argues more strongly for patience. So, given all that, putting it all together, and sorry for the long answer, we remain comfortable with the current amount of excess capital. And as Jamie has said, we really continue to think about it as earnings in store as much as anything else.",['right okay thanks steve actually answering question want remind everyone jamie able join travel conflict overseas going today okay good question capital rotce so let start rotce point first short answer question would no hard imagine scenario coming whole potential range outcomes capital involves upward revision rotce think way weve talking this weve said basel iii endgame proposal 17% cycle target imagine range different outcomes vast majority involve expansions denominator ideas changing perimeter repricing still sort effect would thought mitigants rather things would actually like increase rotce really think answer particularly changed so now thats would say good pivot next point is yeah weve reading press coverage reading fun interesting speculate potential outcomes here reality know anything know know reliable press coverage is so sense feel like overall capital return buyback trajectory much actually changed relative laid investor day comments made then comments jamie made then well comments jamie made subsequent week industry conference so maybe ill briefly summarize everyones benefit think is is one recognize current practice capital return buybacks lead ever-expanding cet1 ratio obviously were going run company cycle time reasonable cet1 ratio reasonable buffers relative requirement so uncertainty sorted out question deployment capital one way another matter when if capital hierarchy also worth noting thats another thing remains unchanged ill review quickly growing business organically inorganically sustainable dividend context worth noting boards announced intention increase $125 19% increase prior last year so thats testament performance return capital then finally buybacks hierarchy commit us return 100% capital generation given quarter so sit today look relationship opportunity cost deploying capital opportunities deploy capital outside firm kind hard imagine environment relationship argues strongly patience so given that putting together sorry long answer remain comfortable current amount excess capital jamie said really continue think earnings store much anything else'],Jeremy Barnum,"Chief Financial Officer, JPMorgan Chase & Co."
62,2Q24,"Hi, good morning. Thanks for taking my question. Jeremy, can you give an update on the stress capital buffer? You noted obviously that you think there is an error in the Fed's calculation due to OCI. Can you just give us a sense of what the dialogue with the Fed looks like? Is there a process to modify the SCB higher and if you could give us a sense of what that process looks like?",['hi good morning thanks taking question jeremy give update stress capital buffer noted obviously think error feds calculation due oci give us sense dialogue fed looks like process modify scb higher could give us sense process looks like'],Saul Martinez,"Analyst, HSBC Securities (USA), Inc","Yeah. So, I'm not going to comment about any conversations with the Fed – not to confirm or deny that they even exist. That stuff is private. And so, then if you talk about, like the timing here, right, so you know that the stress capital buffer that's been released at 3.3% is a preliminary number. By rule, the Fed has to release that by August 31. It may come sooner. You talked about an error in the calculation. We haven't used that word. What we know, what we believe rather is that the amount of OCI gain that came through the Fed's disclosed results looked non-intuitively high to us. And if you adjust that in ways that we think are reasonable, you would get a slightly higher stress capital buffer. Whether the Fed agrees and whether they decide to make that change or not is up to them, and we'll see what happens. I think the larger point is that if you look at the industry as a whole and if you sort of put us into that with some higher pro forma’d SCB, whatever it might suitably be, you actually see once again quite a bit of volatility in the year-on-year change in the stress capital buffer for many firms. And just sort of reiterating and another example of what we've said a lot over the years that it's volatile, it's untransparent, it makes it very hard to manage capital of a bank. It leads to excessively high management buffers, and we think it's really not a great way to do things. So, I'll leave it at that.",['yeah so im going comment conversations fed – confirm deny even exist stuff private so talk about like timing here right know stress capital buffer thats released 33% preliminary number rule fed release august 31 may come sooner talked error calculation used word know believe rather amount oci gain came feds disclosed results looked non-intuitively high us adjust ways think reasonable would get slightly higher stress capital buffer whether fed agrees whether decide make change them well see happens think larger point look industry whole sort put us higher pro forma’d scb whatever might suitably be actually see quite bit volatility year-on-year change stress capital buffer many firms sort reiterating another example weve said lot years volatile untransparent makes hard manage capital bank leads excessively high management buffers think really great way things so ill leave that'],Jeremy Barnum,"Chief Financial Officer, JPMorgan Chase & Co."
