32,3Q23,"Jeremy, you guys have put up a really strong ROTCE number of 22% for the quarter. And when you dive into your different segments, what really jumps out at us is the 40% ex-First Republic ROE in Consumer & Community Banking. I know you and Jamie have talked about your over-earning on credit. We get that. But in view of all of these fintechs and all of these other nonbank competitors that we're all supposed to pick away at everybody's market share, you guys have put up great numbers here. What's the drivers behind an ROE? Even when you take that credit over-earning out, what's driving this business' profitability at such high levels?",['jeremy guys put really strong rotce number 22% quarter dive different segments really jumps us 40% ex-first republic roe consumer & community banking know jamie talked over-earning credit get that view fintechs nonbank competitors were supposed pick away everybodys market share guys put great numbers here whats drivers behind roe even take credit over-earning out whats driving business profitability high levels'],Gerard Cassidy,"Analyst, RBC Capital Markets LLC","Yeah, Gerard. So I'd say a couple things there. So first, it's not just credit. It's also deposit margin, right? So when we talk about over-earning on NII, a disproportionate amount of that is coming out of the Consumer franchise for all of the reasons that we've talked about. But, I would also point out sometimes we don't like the word over-earning because right now, customers are happy and they're doing CDs. And the broader answer to your question about why we're able to be effectively really comes back to a decade, two decade long history of investing for the future and recognizing that there's a holistic value proposition here that includes branches, and the app, and all of the online services, and the entire suite of products and services that is around this enterprise which drives engagement and customer loyalty. And we're seeing some of the benefits of that now, although we're not complacent. The competition is still there. The fintechs are still there, and we know we need to continue investing to preserve the value. And it's also true that the particular circumstances of the current rate and credit environment mean that the earnings are a little bit above normal, but that core franchise is extremely robust.",['yeah gerard id say couple things there first credit also deposit margin right talk over-earning nii disproportionate amount coming consumer franchise reasons weve talked about but would also point sometimes like word over-earning right now customers happy theyre cds broader answer question were able effectively really comes back decade two decade long history investing future recognizing theres holistic value proposition includes branches app online services entire suite products services around enterprise drives engagement customer loyalty were seeing benefits now although were complacent competition still there fintechs still there know need continue investing preserve value also true particular circumstances current rate credit environment mean earnings little bit normal core franchise extremely robust'],Jeremy Barnum,"Chief Financial Officer, JPMorgan Chase & Co."
33,3Q23,"Your new guide for net interest income for this year would imply an exit run rate of $22.9 billion in the fourth quarter. As we think about the dynamics in higher-for-longer, on one hand, your fixed rate assets will continue to reprice. On the other, you even asked a lot about the deposit dynamics that could continue to creep higher. How do we think about those puts and takes as we think about that relative to that exit rate of $22.9 billion in the fourth quarter?",['new guide net interest income year would imply exit run rate $229 billion fourth quarter think dynamics higher-for-longer one hand fixed rate assets continue reprice other even asked lot deposit dynamics could continue creep higher think puts takes think relative exit rate $229 billion fourth quarter'],Erika Najarian,"Analyst, UBS Securities LLC","So call it $90 billion run rate on an exit rate basis, and we're saying that we think something a bit more normal is closer to $80 billion, so that's one building block. Underneath that, I think one thing that's interesting actually, is that as the percentage of the deposits which are CDs increases, the sort of balance between internal migration and betas and rate and volume, it's a little bit less binary and a little bit smoother, so when we look at this type of stuff and we model migration, balances, product level reprice, as you get out of that lower zero bound with 0% CD mix world, things get a little bit smoother, I would say, overall. So it'll be interesting to watch that, but it's obviously one of the most important things for us as a company right now and we do everything we can to manage it, but it's also worth remembering that the big picture point is just the client franchise and as we've often said, we're very focused on primary bank relationships and we didn't lose any of those in the last cycle, and we're not planning to lose any in this cycle, and that's what sort of a long-term focus means for us. And I would just add quantitative tightening in there. That will be a large number, and we don't exactly know the effect, where wholesale, consumer as – remember also the Fed has the RRP program which is also sucking money into the Fed directly and reducing deposits. That's still a trillion too.",['call $90 billion run rate exit rate basis were saying think something bit normal closer $80 billion thats one building block underneath that think one thing thats interesting actually percentage deposits cds increases sort balance internal migration betas rate volume little bit less binary little bit smoother look type stuff model migration balances product level reprice get lower zero bound 0% cd mix world things get little bit smoother would say overall itll interesting watch that obviously one important things us company right everything manage it also worth remembering big picture point client franchise weve often said were focused primary bank relationships lose last cycle were planning lose cycle thats sort long-term focus means us would add quantitative tightening there large number exactly know effect wholesale consumer – remember also fed rrp program also sucking money fed directly reducing deposits thats still trillion too'],"Jeremy Barnum, Jamie Dimon","Chief Financial Officer, JPMorgan Chase & Co.; Chairman & Chief Executive Officer, JPMorgan Chase & Co."
34,3Q23,"The question I have is, does it surprise you that markets are hanging in, that you, yourself, have green shoots or still green shoots type of mind set about banking while that's going on? And then maybe more importantly, if you believe what obviously what you wrote, what are you doing about it? How do you manage yourself conservatively? How do you prepare for tougher times?",['question is surprise markets hanging in you yourself green shoots still green shoots type mind set banking thats going on maybe importantly believe obviously wrote it manage conservatively prepare tougher times'],Glenn Schorr,"Analyst, Evercore ISI","You want to start? Okay. So, I mean, on green shoots, you'll just note that our comments are cautious. I mean, there is momentum. I do think we are a little bit more optimistic than we were, but obviously, markets have been bumpy, both equity markets and rate markets have been very whippy recently. So we don't want to get too carried away with optimism here. We are coming in off a very low base and so there's a hope and an expectation that we are on the path to normalization and improvement. And of course, the overall economic picture at least currently looks solid, this sort of immaculate disinflation trade is actually happening. So those are all reasons to be a little bit optimistic in the near-term, but it's tempered with quite a bit of caution.",['want start okay so mean green shoots note comments cautious mean momentum think little bit optimistic were obviously markets bumpy equity markets rate markets whippy recently want get carried away optimism here coming low base theres hope expectation path normalization improvement course overall economic picture least currently looks solid sort immaculate disinflation trade actually happening reasons little bit optimistic near-term tempered quite bit caution'],Jeremy Barnum,"Chief Financial Officer, JPMorgan Chase & Co."
35,3Q23,"Hi. I understand the NII strategy benefited from First Republic, asset sensitivity, CD strategy, money in motion, and I'm curious to how much is the NII increase and the deposit benefits a function of the 67 million digital banking customers? Do you have more digital banking customers than branch customers now? If you can just refresh that.",['hi understand nii strategy benefited first republic asset sensitivity cd strategy money motion im curious much nii increase deposit benefits function 67 million digital banking customers digital banking customers branch customers now refresh that'],Mike Mayo,"Analyst, Wells Fargo Securities LLC","Yes. Let me do digital banking, Mike. I spent some time on this actually a couple weeks ago. And it's interesting to note this sort of extent to which the growth in digitally engaged consumers is higher than the overall growth in consumer accounts, meaning that we're continuing to increase the percentage of our consumers that are digitally engaged. And it sort of goes back to my prior point...",['yes let digital banking mike spent time actually couple weeks ago interesting note sort extent growth digitally engaged consumers higher overall growth consumer accounts meaning were continuing increase percentage consumers digitally engaged sort goes back prior point'],Jeremy Barnum,"Chief Financial Officer, JPMorgan Chase & Co."
36,3Q23,"Hey. Good morning. Jeremy, do you think there's any receptivity among regulators regarding the double counting not only of operational risk but I think you alluded to this earlier in the Markets business, but there's clearly double counting in market risk in the trading book. Is there any receptivity?",['hey good morning jeremy think theres receptivity among regulators regarding double counting operational risk think alluded earlier markets business theres clearly double counting market risk trading book receptivity'],Jim Mitchell,"Analyst, Seaport Global Securities LLC","Can I just answer that real quickly? We don't really know. It's a one-sided conversation generally. They say put it in your comments, so everyone is going to put in extensive comments, kind of like you heard from Jeremy and we don't really know. We don't really know what's going on inside the Fed, how many people get involved. In my view, it's become a very politicized process as opposed to the technical analysis I think is required to do it exactly right. So we'll see.",['answer real quickly really know one-sided conversation generally say put comments everyone going put extensive comments kind like heard jeremy really know really know whats going inside fed many people get involved view become politicized process opposed technical analysis think required exactly right well see'],Jamie Dimon,"Chairman & Chief Executive Officer, JPMorgan Chase & Co."
37,3Q23,"Hi, good morning. You talked about increased investment spend in some areas in response to an earlier question. But just how do you think about cost control overall, looking at the medium term? The outlook for revenue is obviously pressured at least on net interest income. Fees might help, but the backdrop is for potentially declining revenue or at least flattish revenue for a couple or few years. So, I know you always say you want to invest for the cycle, and it's really paid off over time, but how are you thinking about cost control the next few years?",['hi good morning talked increased investment spend areas response earlier question think cost control overall looking medium term outlook revenue obviously pressured least net interest income fees might help backdrop potentially declining revenue least flattish revenue couple years so know always say want invest cycle really paid time thinking cost control next years'],Matt O'Connor,"Analyst, Deutsche Bank Securities, Inc.","Yeah. I mean, I wish I had sort of an answer that fit better into your framework. But in some fundamental sense, we just kind of don't agree with the framework in the sense that and we've been through this over the last couple of years, right? In a world where rates drop very suddenly and recover quite dramatically, and credit becomes abnormally good and then rebounds, and you've seen these very significant fluctuations in capital markets. We saw that in 2021 going into 2022 where the revenue environment can change a lot in the short term for reasons that can be largely out of your control. And while of course there are parts of our expense base, which are in the short term directly sensitive to the revenue environment and some of those adjust naturally and some of them we adjust more forcefully as a function of volumes, but other things are much more structural. And the goal is to make sure that those other things are sized appropriately to what we believe sustainable through the cycle returns are. So we're always very focused on cost. You can be rest assured of that. That discipline internally is as aggressive as ever as we go through the budget cycle. But there are long-term plays and you really shouldn’t expect us to see trying to generate cosmetically lower costs in response to a lower revenue environment where we didn’t balloon the costs when the revenue became as we’ve argued unsustainably high.",['yeah mean wish sort answer fit better framework fundamental sense kind agree framework sense weve last couple years right world rates drop suddenly recover quite dramatically credit becomes abnormally good rebounds seen significant fluctuations capital markets saw 2021 going 2022 revenue environment change lot short term reasons largely control course parts expense base short term directly sensitive revenue environment adjust naturally adjust forcefully function volumes things much structural goal make sure things sized appropriately believe sustainable cycle returns are were always focused cost rest assured that discipline internally aggressive ever go budget cycle long-term plays really shouldn’t expect us see trying generate cosmetically lower costs response lower revenue environment didn’t balloon costs revenue became we’ve argued unsustainably high'],Jeremy Barnum,"Chief Financial Officer, JPMorgan Chase & Co."
38,3Q23,There are no further questions.,['questions'],Jamie Dimon,"Chairman & Chief Executive Officer, JPMorgan Chase & Co.",Thank you very much.,['thank much'],Jamie Dimon,"Chairman & Chief Executive Officer, JPMorgan Chase & Co."
39,4Q23,Good morning. Thanks for all the comments on the net interest income. Any updates on that medium term outlook that you've put out there?,['good morning thanks comments net interest income updates medium term outlook put there'],Matt O'Connor,"Analyst, Deutsche Bank Securities, Inc.","Yeah. Matt, not particularly updating. I think you're referring to that $80 billion number that we'd put out there, and I wouldn't exactly describe that as an outlook. I think it's more just a number that we put out there to try to quantify a little bit the extent of the overearning. So, not particularly necessary to revise the number. But I just would point out, again, as we highlight on the page, and as I highlighted in the prepared remarks, that when you look at that $94 billion exit rate and full year guidance of $88 billion, that implies obviously exiting below $88 billion and some significant sequential decline. So, in that sense, you can see us kind of marching on the path to that $80 billion. Whether we ever get to the $80 billion or not and when is maybe a topic for later in the year or next year.",['yeah matt particularly updating think referring $80 billion number wed put there exactly describe outlook think number put try quantify little bit extent overearning so particularly necessary revise number would point out again highlight page highlighted prepared remarks look $94 billion exit rate full year guidance $88 billion implies obviously exiting $88 billion significant sequential decline so sense see us kind marching path $80 billion whether ever get $80 billion maybe topic later year next year'],Jeremy Barnum,"Chief Financial Officer, JPMorgan Chase & Co."
40,4Q23,"Jeremy, could you give a little more color on what's baked into the loan loss reserve in terms of kind of weighted average assumptions and how any change in macro outlook played into the dynamics of the reserve builds and releases this quarter?",['jeremy could give little color whats baked loan loss reserve terms kind weighted average assumptions change macro outlook played dynamics reserve builds releases quarter'],John McDonald,"Analyst, Autonomous Research","Yeah. Actually, John, this quarter, that's all like pretty quiet. So, the weighted average unemployment rate number is still 5.5%. We didn't have any really big revisions in the macro outlook driving the numbers, and our skew remains as it has been 
 a little bit skewed to the downside. Just recognizing that we still see risks being elevated, which obviously you can see that skew in the difference between the weighted average unemployment of 5.5%, and what's in our central outlook, which I think is something like 4.6% (sic) [4.4%] peak of the current levels.",['yeah actually john quarter thats like pretty quiet so weighted average unemployment rate number still 55% really big revisions macro outlook driving numbers skew remains little bit skewed downside recognizing still see risks elevated obviously see skew difference weighted average unemployment 55% whats central outlook think something like 46% (sic) [44%] peak current levels'],Jeremy Barnum,"Chief Financial Officer, JPMorgan Chase & Co."
41,4Q23,"Hey. Good morning. Maybe just to follow up in a different way on the NII question, just in deposits, can you, Jeremy, discuss your assumptions on the reprice and migration thoughts? And then, layering in if we do get six cuts, does that start to change the dynamic around growth in deposits? How are you thinking about all that?",['hey good morning maybe follow different way nii question deposits you jeremy discuss assumptions reprice migration thoughts then layering get six cuts start change dynamic around growth deposits thinking that'],Jim Mitchell,"Analyst, Seaport Global Securities LLC","Yeah. Both good questions. So let's do reprice first. So, I think all else equal, this more dovish Fed environment and these six cuts has the effect of taking a little bit of pressure off the reprice, especially product-level reprice. At the same time, we do continue to expect internal migration, particularly out of checking and savings into CDs, and in Wholesale, a little bit of ongoing migration out of non-interest-bearing into interest-bearing. And that trajectory, I would expect to continue even in a lower rate environment. So, as a result, if you look at weighted average rate paid, for example, for the consumer deposit franchise, we would actually expect that number to be a little bit higher, just even in a world with six cuts. And that's actually intuitive when you think about it, as people continue migrating into CDs, but maybe a little non-intuitive if you're kind of trying to do beta type math with like change in rates and change in rate paid. It gets a little bit non-intuitive. And then, in terms of balances, yeah, you'll note that I said that our outlook is for balances to be very modestly down, which when you consider the QT, despite the various speculations about having it slow down later in the year, continues and that loan growth in the system as a whole is expected to be quite muted. It's a pretty modest decline outlook consistent with the lower rates. So, I kind of agree with you that this environment is at the margin, a little bit more supportive for system-wide deposit balances. And then, obviously, we continue to be optimistic about our ability to take share in deposits based on our customer value proposition across all of our different businesses.",['yeah good questions lets reprice first so think else equal dovish fed environment six cuts effect taking little bit pressure reprice especially product-level reprice time continue expect internal migration particularly checking savings cds wholesale little bit ongoing migration non-interest-bearing interest-bearing trajectory would expect continue even lower rate environment so result look weighted average rate paid example consumer deposit franchise would actually expect number little bit higher even world six cuts thats actually intuitive think it people continue migrating cds maybe little non-intuitive kind trying beta type math like change rates change rate paid gets little bit non-intuitive then terms balances yeah note said outlook balances modestly down consider qt despite various speculations slow later year continues loan growth system whole expected quite muted pretty modest decline outlook consistent lower rates so kind agree environment margin little bit supportive system-wide deposit balances then obviously continue optimistic ability take share deposits based customer value proposition across different businesses'],Jeremy Barnum,"Chief Financial Officer, JPMorgan Chase & Co."
42,4Q23,"Do you believe that the outlook for a soft landing has increased? Is the market pricing in correctly? Or when you look at your customer base, are you still worried about the lagged effects of the rate hikes?",['believe outlook soft landing increased market pricing correctly look customer base still worried lagged effects rate hikes'],Ebrahim H. Poonawala,"Analyst, Bank of America Merrill Lynch","I think a lot of those things aren't actually mutually exclusive. So, statement one, I think it's uncontroversial that the economic outlook has evolved to include a significantly higher probability of a soft landing. That's, I think, the consensus at this point. So, whether you believe it or not is a separate issue, but I think that is the consensus. In terms of consumer resilience, I made some comments about this on the press call. The way we see it, the consumer is fine. All of the relevant metrics are now effectively normalized. And the question really, in light of the fact that cash buffers are now also normal, but that that means that consumers have been spending more than they're taking in, is how that spending behavior adjusts as we go into the new year in a world where their cash buffers are less comfortable than they were. So, one can speculate about different trajectories that that could take. But I do think it's important to take a step back and remind ourselves that consistent with that soft landing view, just in the central case modeling – obviously, we always worry about the tail scenarios – is a very strong labor market. And a very strong labor market means, all else equal, strong consumer credit. So, that's how we see the world.",['think lot things actually mutually exclusive so statement one think uncontroversial economic outlook evolved include significantly higher probability soft landing thats think consensus point so whether believe separate issue think consensus terms consumer resilience made comments press call way see it consumer fine relevant metrics effectively normalized question really light fact cash buffers also normal means consumers spending theyre taking in spending behavior adjusts go new year world cash buffers less comfortable were so one speculate different trajectories could take think important take step back remind consistent soft landing view central case modeling – obviously always worry tail scenarios – strong labor market strong labor market means else equal strong consumer credit so thats see world'],Jeremy Barnum,"Chief Financial Officer, JPMorgan Chase & Co."
