69,2Q24,The consensus provision for 2024 is $10.7 billion. Could you maybe clarify for once and for all sort of Jamie's comments at an industry conference earlier and try to sort of triangulate if that $10.7 billion provision is appropriate for the growth level that you are planning for in Card?,['consensus provision 2024 $107 billion could maybe clarify sort jamies comments industry conference earlier try sort triangulate $107 billion provision appropriate growth level planning card'],Erika Najarian,"Analyst, UBS Securities LLC","Yeah. Happy to clarify that. So, Jamie's comments were that the allowance – the build and the Card allowance, so we're talking about Card specifically, we expected something like $2 billion for the full year. As I sit here today, our expectation for that number is actually slightly higher, but it's in the ballpark. And I think in terms of what that means for the consensus on the overall allowance change for the year, last time I checked, it still looked a little low on that front. So, who knows what it'll actually wind up being, but that remains our view. One question that we've gotten is how to reconcile that build to the 12% growth in OS that we've talked about because it seems like a little bit high relative to what you would have otherwise assumed if you apply some sort of a standard coverage ratio to that growth. But the reason that's the case is essentially a combination of higher revolving mix, as we continue to see some normalization revolve in that 12%, as well as seasoning of earlier vintages, which comes with slightly higher allowance per unit of OS growth.",['yeah happy clarify that so jamies comments allowance – build card allowance were talking card specifically expected something like $2 billion full year sit today expectation number actually slightly higher ballpark think terms means consensus overall allowance change year last time checked still looked little low front so knows itll actually wind being remains view one question weve gotten reconcile build 12% growth os weve talked seems like little bit high relative would otherwise assumed apply sort standard coverage ratio growth reason thats case essentially combination higher revolving mix continue see normalization revolve 12% well seasoning earlier vintages comes slightly higher allowance per unit os growth'],Jeremy Barnum,"Chief Financial Officer, JPMorgan Chase & Co."
70,2Q24,"Oh, hey, good morning. Maybe just one last question on sort of deploying excess capital. It seems like the two primary ways to do that organically would be through the trading book or the loan book. So, maybe two questions there. One, trading assets were up 20% year-over-year. Is that you leaning into it or just a function of demand? And is there further opportunities to grow that? And then, secondly, outside of Card, loan demand has been quite weak and any thoughts from you on if you're seeing any change in demand or how you're thinking about loan demand going forward? Thanks.",['oh hey good morning maybe one last question sort deploying excess capital seems like two primary ways organically would trading book loan book so maybe two questions there one trading assets 20% year-over-year leaning function demand opportunities grow that then secondly outside card loan demand quite weak thoughts seeing change demand thinking loan demand going forward thanks'],Jim Mitchell,"Analyst, Seaport Global Securities LLC","Thanks, Jim. Good questions. So, yeah, trading assets have been up. That is basically client activity, primarily secured financing-related sort of matchbook repo-type stuff and similar things that are – gross up the balance sheet quite a bit, but are quite low risk and therefore, quite low RWA intensity. So, while our ability to supply that financing to clients is something that we're happy about and it's very much represents us leaning into the franchise to serve our clients. It's not really particularly RWA and therefore, capital intensive and therefore, doesn't really reflect an aggressive choice on our part to deploy capital, so to speak. On the loan demand front, yeah, I mean, unfortunately, I just don't have much new to say there on loan demand, meaning, to your point, loan demand remains quite muted everywhere except Card. Our Card business is, of course, in no way capital constrained. So, whatever growth makes sense there in terms of our customer franchise and our ability to acquire accounts and retain accounts and what fits inside our credit risk appetite, is growth that's going to make sense. And so, we're very happy to deploy capital to that. But it's not constrained by our willingness or ability to deploy capital to that. And, of course, for the rest of the loan space, the last thing that we're going to do is have the excess capital, meaning that we lean into lending that is not inside our risk appetite or inside our credit box, especially in a world where spreads are quite compressed and terms are under pressure. So, there's always a balance between capital deployment and assessing economic risk rationally and frankly, that is, in some sense, a microcosm of the larger challenge that we have right now. When I talked about if there was ever a moment where the opportunity cost of not deploying the capital relative to how attractive the opportunities outside the walls of the company are, now would be it in terms of being patient. That's a little bit one example of what I was referring to.",['thanks jim good questions so yeah trading assets up basically client activity primarily secured financing-related sort matchbook repo-type stuff similar things – gross balance sheet quite bit quite low risk therefore quite low rwa intensity so ability supply financing clients something were happy much represents us leaning franchise serve clients really particularly rwa therefore capital intensive therefore really reflect aggressive choice part deploy capital speak loan demand front yeah mean unfortunately much new say loan demand meaning point loan demand remains quite muted everywhere except card card business is course way capital constrained so whatever growth makes sense terms customer franchise ability acquire accounts retain accounts fits inside credit risk appetite growth thats going make sense so were happy deploy capital that constrained willingness ability deploy capital that and course rest loan space last thing were going excess capital meaning lean lending inside risk appetite inside credit box especially world spreads quite compressed terms pressure so theres always balance capital deployment assessing economic risk rationally frankly is sense microcosm larger challenge right now talked ever moment opportunity cost deploying capital relative attractive opportunities outside walls company are would terms patient thats little bit one example referring to'],Jeremy Barnum,"Chief Financial Officer, JPMorgan Chase & Co."
71,2Q24,We have no further questions.,['questions'],Jeremy Barnum,"Chief Financial Officer, JPMorgan Chase & Co.","Very good. Thank you, everyone. See you next quarter.",['good thank you everyone see next quarter'],Jeremy Barnum,"Chief Financial Officer, JPMorgan Chase & Co."
72,3Q24,"Hey, good morning. So, Jeremy, as you highlighted, full year NII guidance implies a sizable drop in Q4 NII ex. Markets about 6%. So, can you just maybe discuss what are the largest drivers of the sequential decline including any initial thoughts on deposit behavior and pricing since the 50 basis point cut? And since it's related, I'll just throw out my follow-up question. I realize the forward curve is moving around a lot, but since Dan brought it up a month ago, can you frame how you're thinking about the NII trajectory for 2025?",['hey good morning so jeremy highlighted full year nii guidance implies sizable drop q4 nii ex markets 6% so maybe discuss largest drivers sequential decline including initial thoughts deposit behavior pricing since 50 basis point cut since related ill throw follow-up question realize forward curve moving around lot since dan brought month ago frame thinking nii trajectory 2025'],Jim Mitchell,"Analyst, Seaport Global Securities LLC","Yeah. Sure, Jim. I'll try to answer both questions together to the best of my ability. So, as we sit here today, the biggest single driver of the sequential decline is, in fact – that we're expecting – is, in fact, the yield curve. So, that yield curve has changed a little bit since Daniel made his comments at the conference earlier in the quarter, but not that significantly. In terms of deposit balances, which is obviously another important factor here in light of the Fed starting the cutting cycle, it feels to us like right now, as I mentioned in my prepared remarks for Consumer, we're pretty much in the trough right now as we speak. When you look at yield-seeking behavior that has come down quite a bit, so that's no longer as much of a headwind all else being equal. And then if you look at checking account balances, those have been pretty stable for some time, which we see as an indication that consumers are kind of done spending down their cash buffers. So that's kind of supportive for consumer deposit balances. And in that context, the other relevant point is the CD mix where, with the rate cuts coming, we expect CD balances to price down with pretty high betas and probably the CD mix actually peaking around now. And then as we move to Wholesale, we've actually already been seeing a little bit of growth there, and when you combine that with the sort of increasing view that many people in the market have that it's likely that the end of QT will be announced sometime soon, that's also a little bit supportive for deposit balances. So, maybe, I'll – well, I guess then you also asked me a little bit about next year. So, I guess one thing to say, right, is that we did have a sequential increase in NII this quarter and, as you may recall, at Investor Day, I said that there was some chance that we would see sequential increases followed by sequential declines and that people should avoid kind of drawing the conclusion that we'd hit the trough when that happens. So that's essentially exactly what we're seeing now. But from where we sit now, given the yield curve, assuming the yield curve materializes obviously, we do see a pretty clear picture of sequential declines in NII ex. Markets, but the trough may be happening sometime in the middle of next year, at which point the combination of balances, Card revolve growth and other factors can return us to sequential growth, obviously. We're guessing it's pretty far out in the future, and we'll give you formal guidance on all this stuff next quarter, but I think that gives you a better framework to work with.",['yeah sure jim ill try answer questions together best ability so sit today biggest single driver sequential decline is fact – were expecting – is fact yield curve so yield curve changed little bit since daniel made comments conference earlier quarter significantly terms deposit balances obviously another important factor light fed starting cutting cycle feels us like right now mentioned prepared remarks consumer were pretty much trough right speak look yield-seeking behavior come quite bit thats longer much headwind else equal look checking account balances pretty stable time see indication consumers kind done spending cash buffers thats kind supportive consumer deposit balances context relevant point cd mix where rate cuts coming expect cd balances price pretty high betas probably cd mix actually peaking around now move wholesale weve actually already seeing little bit growth there combine sort increasing view many people market likely end qt announced sometime soon thats also little bit supportive deposit balances so maybe ill – well guess also asked little bit next year so guess one thing say right sequential increase nii quarter and may recall investor day said chance would see sequential increases followed sequential declines people avoid kind drawing conclusion wed hit trough happens thats essentially exactly were seeing now sit now given yield curve assuming yield curve materializes obviously see pretty clear picture sequential declines nii ex markets trough may happening sometime middle next year point combination balances card revolve growth factors return us sequential growth obviously were guessing pretty far future well give formal guidance stuff next quarter think gives better framework work with'],Jeremy Barnum,"Chief Financial Officer, JPMorgan Chase & Co."
73,3Q24,"So Jeremy, how are you? So I do want to ask on expenses, just in light of some of the comments that Daniel had made recently, just noting that consensus expense forecast for next year looked a little bit too light. I believe at the time it was just below $94 billion. If we adjust for the one-timers this year, that would suggest a core expense base that's just below $90 billion, so pretty healthy step-up in expenses. I know you've always had a strong commitment and discipline around investment. Just want to better understand where those incremental dollars are being deployed and just which investments are being prioritized in particular looking out to next year.",['jeremy you want ask expenses light comments daniel made recently noting consensus expense forecast next year looked little bit light believe time $94 billion adjust one-timers year would suggest core expense base thats $90 billion pretty healthy step-up expenses know always strong commitment discipline around investment want better understand incremental dollars deployed investments prioritized particular looking next year'],Steven Chubak,"Analyst, Wolfe Research LLC","Sure. So good question and I agree with your numbers. I agree with the way you've normalized this year for the one-time type of significant items and also where the consensus was when Daniel made his comments. And while we're at it, I would also just remind you on the NII comments at the time, the consensus for this year was $91.5 billion and for next year it was $90 billion so that was implying at the time a sequential decline of $1.5 billion. It was because we felt that decline wasn't big enough that we made the comments that we made. So happy to expand more on that, but anyway. To expenses. Yeah. So if you start for the sake of argument with a base of $90 billion, obviously, inflation is normalizing and obviously we're always trying to generate efficiencies to offset inflation. But, that having been said, if you assume 3% for the sake of argument on that base, that's a few billion dollars right out of the gates that we're working against. So that's one thing. The other thing is that we have continued to execute on our growth strategies this year so there's a not insignificant amount of annualization. You can't quite see that in the fourth quarter numbers because of the seasonality of incentive comp., but if you were to strip that out, you would see probably some sequential increases and so annualization as an additional headwind. The other thing that's worth noting is that we do expect fees and volume-related businesses to grow next year. And so all else being equal, that would come with a higher expense loading. So when you assemble all of those, that goes a long way to explain why sort of that consensus number that is slightly below $94 billion just seemed light. In terms of priorities and investments, really nothing has changed, like the strategy hasn't changed. The strategy hasn't changed and the plans haven't changed and we're just kind of executing with the same long-term perspective that we've always had. I would note that relative to NII, obviously, we're in the third quarter now, not the fourth quarter. And in the old days, we did used to give you the guidance until Investor Day in late February. So we will give you formal expense guidance next quarter for both, well, for expenses and NII next quarter. But especially on expenses, we are in the middle of the budget cycle right now so we probably have a little less visibility there than we do at the margin on NII.",['sure good question agree numbers agree way normalized year one-time type significant items also consensus daniel made comments were it would also remind nii comments time consensus year $915 billion next year $90 billion implying time sequential decline $15 billion felt decline big enough made comments made happy expand that anyway expenses yeah start sake argument base $90 billion obviously inflation normalizing obviously were always trying generate efficiencies offset inflation but said assume 3% sake argument base thats billion dollars right gates were working against thats one thing thing continued execute growth strategies year theres insignificant amount annualization cant quite see fourth quarter numbers seasonality incentive comp strip out would see probably sequential increases annualization additional headwind thing thats worth noting expect fees volume-related businesses grow next year else equal would come higher expense loading assemble those goes long way explain sort consensus number slightly $94 billion seemed light terms priorities investments really nothing changed like strategy changed strategy changed plans changed were kind executing long-term perspective weve always had would note relative nii obviously were third quarter now fourth quarter old days used give guidance investor day late february give formal expense guidance next quarter both well expenses nii next quarter especially expenses middle budget cycle right probably little less visibility margin nii'],Jeremy Barnum,"Chief Financial Officer, JPMorgan Chase & Co."
74,3Q24,"My first question, and thank you very much for answering all the NII questions so far, Jeremy, is just I guess another follow-up. As you can imagine, once Daniel said what he said on stage in September, everyone is trying to figure out the over/under for net interest income next year. So maybe a two-part first question, the second being inspired by what Jamie just said. Number one, NII is expected to be down 6% sequentially in fourth quarter. I think year-over-year in 2025, consensus has it down 4% from your new level. So it sounds like consensus still has room to come down, and based on the forward curve, Jeremy, it could be a little bit worse year-over-year than the fourth quarter sequential rate. But that being said, as Jamie noted, we have no idea what the curve is going to look like. Right? It's gyrated so much. And so as we think about the curve, is it better for JPMorgan to have more cuts in the short end but steepness or less cuts but a little bit of a flatter curve?",['first question thank much answering nii questions far jeremy guess another follow-up imagine daniel said said stage september everyone trying figure over/under net interest income next year maybe two-part first question second inspired jamie said number one nii expected 6% sequentially fourth quarter think year-over-year 2025 consensus 4% new level sounds like consensus still room come down based forward curve jeremy could little bit worse year-over-year fourth quarter sequential rate said jamie noted idea curve going look like right gyrated much think curve better jpmorgan cuts short end steepness less cuts little bit flatter curve'],Erika Najarian,"Analyst, UBS Securities LLC","Right. Okay. You threw a curve ball at the end there, Erika. I wasn't expecting that to be the end of your question. But let me answer the beginning of your question, and then I'll also answer the end of your question. So we see the current 2025 consensus for NII ex. Markets to be currently at $87 billion, which is obviously lower than it was at the conference earlier in the quarter. So we're happy to see that move a little bit more in line to us. That still looks a little toppy, but it's definitely in the ballpark. Now that consists of, I already mentioned previously that we sort of expect the NII trough sometime in the middle of the year, so you can kind of assemble the parts. You've got a fourth quarter run rate, you've got some sequential declines, you've got a trough in the middle of the year, and you've got a rough ballpark for the full year. So you can imagine that the trough probably is a little lower than those numbers and then to the extent that growth revolves resumes in the back half of the year in both deposit balances and the ongoing tailwind of Card revolve, although that tailwind will be a little bit less than you might have otherwise thought. I mean, sorry. A little bit less than it was this year but still a tailwind. Obviously, the mix of those things will play out in different ways, and as you point out, who knows what the yield curve will wind up doing. But on our current assumptions, on the current yield curve, and remembering that we're in the third quarter now, so we're doing this kind of early, that's what we think.",['right okay threw curve ball end there erika expecting end question let answer beginning question ill also answer end question see current 2025 consensus nii ex markets currently $87 billion obviously lower conference earlier quarter were happy see move little bit line us still looks little toppy definitely ballpark consists of already mentioned previously sort expect nii trough sometime middle year kind assemble parts got fourth quarter run rate got sequential declines got trough middle year got rough ballpark full year imagine trough probably little lower numbers extent growth revolves resumes back half year deposit balances ongoing tailwind card revolve although tailwind little bit less might otherwise thought mean sorry little bit less year still tailwind obviously mix things play different ways point out knows yield curve wind doing current assumptions current yield curve remembering were third quarter now were kind early thats think'],Jeremy Barnum,"Chief Financial Officer, JPMorgan Chase & Co."
