filename,Quarter,Question,Question_cleaned,Analyst_Bank,Response,Response_cleaned,Executive
4q23-earnings-call-remarks.pdf,4Q23,"Good morning. Thank you for taking my questions. So, the first one would just be going back to some of the math that Kian outlined at the start. I'm just trying to understand your decision-making process. So, if you look at slide 20, I think you said the 9% revenue to RWA post-Basel IV. So, you're suggesting exit run rate $46 billion of revenues, 70% cost income, $32 billion of costs and that's a couple of billion below the full year 2026 consensus revenues and full year 2026 costs, appreciate we’re comparing exit versus full year there. But with that in mind, could you elaborate on where you've identified the additional cost opportunities given that you previously said $10 billion, you're now at $13 billion and you're on the tape of saying we are sacrificing some topline growth in order to enhance returns. So also, where you've made the decision to perhaps come out of some product areas where there was a revenue opportunity? That's the first question. Second question is on capital return. Again, trying to run the numbers, $510 billion RWAs, 14% core Tier 1. You need to be, on that basis, $71.5 billion in core Tier 1 capital. You're at $78 billion today. So, already a lot of excess capital there, then there's the retained earnings coming through. So, just trying to understand. Are there any other moving parts aside from that amortization in the FINMA waiver between tangible equity and core Tier 1 capital over the next three to four years? Thank you.It's exactly that. Just trying to get with the capital build. Thank you.That's great. Perhaps I could just follow-up on the opening remark, I think you said my revenue calculation was wrong on slide 20. The $510 billion I think is post-Basel IV and in the footnote you said 9% post-Basel IV finalization model update. So, should we be taking $510 billion times the 9% or $510 billion times the 10% on the slide? Just to be clear.Brilliant. Thank you.",['so let todd take questions noting may got revenues wrong may address issue okay yes so andy hey go cost side think addressed revenue side anyway response kian would – also – also important point quickly slide say there pre-impact basel iii final model update that know also impact return rwa terms additional cost opportunities found asked mean first would say confirming said last year greater $10 billion saying go work validate details so know $13 billion come with neither sergio think thats know going further us always neighborhood where know thought plan – detailed bottom-up plans would get us ultimately communicating greater $10 billion know informed estimate course done fair bit work course work done last three months validating that know number so thats sort first thing important emphasize gone deeper terms – basis would say $13 billion remains us gross basis critical know said half going personnel related half – half consisting comprised things like mainly tech also real estate also third party costs so again validation done also highlighted going trajectories giving sense think head through quickly – asked about know sacrificing topline growth think point sergio made course financial resource optimization work done before know naturally reduce balance sheet means times well know going sacrificing revenues assets come down so know comes accretion return cet1 ultimately think terms trade-offs so thats would respond that think saying differences took point cet1 tangible equity point making differences think saying andy yes well pointing terms convergence highlighted know historically one big differentiators cet1 think way right right model anyway thats basis able buy back shares pay dividends think know measuring return cet1 capital right know theres always interest cet1 versus te so suggesting – tax loss dtas one big differentiators amortizing converted temp difference dtas cet1 accretive becomes much less delta therefore know signals move towards convergenceyeah maybe let add quickly comment driving optimization balance sheet return risk-weighted assets mentioned planning exit products say that know never say never next two three years never know developments work out stage everything don’t deem product want part non-core so repricing existing core relationships businesses exiting businesses mean talking meaningful businesses course right so expect – really thats reason immediate effect manage relationship manage discussion clients way understand risk-reward us them understand value advice give clients services products give also make sure that know applicable stop discounts so time course going help close gapwell would $510 billion times 9% since would return inclusive – thats apples apples'],Citigroup,"So, I'll let Todd take the questions and only noting that you may have got the revenues wrong, but you may address this issue. Okay. Yes. So, Andy, hey. I will just go on the cost side because I think I addressed the revenue side anyway in response to Kian. I would – I'd also – it's also important to point out just quickly on that slide that as we say in there, it's pre-impact from the Basel III final and model update so that, you know, also will impact on the return of RWA. In terms of the additional cost opportunities that we found, as you asked, I mean, first, I would say we're just confirming what we said last year about greater than $10 billion and saying we had to go do the work to validate all the details. And so, you know, the $13 billion that we've come out with, neither Sergio nor I think that that's, you know, going further. It was for us always the neighborhood of where, you know, we thought the plan – the detailed bottom-up plans would get us. And ultimately, when we were communicating greater than $10 billion, you know, that was an informed estimate of course because we had done a fair bit of work. But of course, all the work that we've done over the last three months validating that, you know, that number. So, that's sort of the first thing is just important to emphasize that it's not as if we've gone deeper. But in terms – so on that basis, I would just say that the $13 billion remains for us on a gross basis, critical. You know, we said half is going to be personnel related. Half is – the other half will be consisting comprised of things like mainly tech but also real estate, also third party costs. So, again, it's a validation of what we've done and also as I highlighted going through the trajectories, giving you a sense of when we think these will head through. And just quickly on the – you asked about, you know, sacrificing topline growth. I think the point that both Sergio and I have made is just of course when you do a financial resource optimization work, and we've done this before, you know, naturally to reduce the balance sheet means at times, well, you know, you're going to be sacrificing revenues as assets come down. And so, you know, it all comes down to the accretion of return on CET1 ultimately and how we think about this in terms of trade-offs. So, that's how I would respond to that. And then I think you were saying any other differences, if I took your point on CET1 and tangible equity. Was that the point that you were making the differences, I think you were saying, Andy. Yes. Well, I was just pointing out in terms of convergence, as I highlighted, you know, historically one of the big differentiators between CET1, which we think, by the way, is the right is the right model anyway because that's the basis for being able to buy back shares and pay dividends, so we think, you know, measuring return on CET1 capital is right. But we know there's always interest in that CET1 versus TE. So, what I was just suggesting was that our – as our tax loss DTAs, which were one of the big differentiators, are amortizing down and being converted into temp difference DTAs which are CET1 accretive, that that becomes much less of a delta and therefore, you know, signals a move towards convergence.Yeah, Maybe let me just add quickly to your comment on driving optimization of the balance sheet and return on risk-weighted assets. You mentioned if we are planning to exit products, I have to say that, you know, never say never because in the next two or three years, you never know how developments work out. But at this stage, everything that we don’t deem as a product that we want to have is part of non-core. So, it's all about repricing the existing core relationships and businesses. It's not about exiting businesses. I mean, I'm talking about meaningful businesses, of course, right? So, I don't expect – it's really and that's the reason why it's not an immediate effect because we have to manage the relationship. We have to manage the discussion with clients in a way that they understand risk-reward for us, for them. They understand the value of the advice we give to clients, the services and products we give. We also have to make sure that, you know, where applicable, we stop having discounts. And so, this is over time, of course, is going to help to close the gap.Well, it would be $510 billion times the 9% since that would be the return inclusive of the – so that's apples and apples.",['good morning thank taking questions so first one would going back math kian outlined start trying understand decision-making process so look slide 20 think said 9% revenue rwa post-basel iv so suggesting exit run rate $46 billion revenues 70% cost income $32 billion costs thats couple billion full year 2026 consensus revenues full year 2026 costs appreciate we’re comparing exit versus full year there mind could elaborate identified additional cost opportunities given previously said $10 billion $13 billion tape saying sacrificing topline growth order enhance returns also made decision perhaps come product areas revenue opportunity thats first question second question capital return again trying run numbers $510 billion rwas 14% core tier 1 need be basis $715 billion core tier 1 capital $78 billion today so already lot excess capital there theres retained earnings coming through so trying understand moving parts aside amortization finma waiver tangible equity core tier 1 capital next three four years thank youits exactly that trying get capital build thank youthats great perhaps could follow-up opening remark think said revenue calculation wrong slide 20 $510 billion think post-basel iv footnote said 9% post-basel iv finalization model update so taking $510 billion times 9% $510 billion times 10% slide clearbrilliant thank you'],"['Todd Tuckner', 'Sergio P. Ermotti']"
4q23-earnings-call-remarks.pdf,4Q23,"Yeah. Sorry. Hopefully that works. If you can talk about the path from the 15% to the 18% in 2028 return on core Tier 1 capital. Given you had 15% to 18% before, so how conservative is the timing as well as the 18% compared to your previous range and how much is at self-help versus market? And the second question is a Q4 question. Your net fee generating assets were negative in Q4. If you can maybe elaborate a bit on what's been driving this? Thank you.Thank you.",['anke take one think – take second todd guess exit rate trying model potential outline definitely converge back level value creation middle range since maybe also appropriate remember wanted really reiterate old story would talked 15% 18% saying believe exit rate 18% so believe combined story time deliver better stable less volatile returns returns mid range between know 15% around 18% so would say thats nuances changes one mentioned so talking 15% 18% believe well-positioned sustainably high teens going forward think level conservative five years ahead need really work execution phase understand potential time fine tune short-term ambitionsand anke net new fee generating assets quarters mentioned negative unpack bit saw good nnfga ubs platform see bit credit suisse dynamic terms mandates credit suisse platform fact net outflow mandates also could well relationship managers left countering virtue aligned cio view aligned solutions offerings bringing – platforms so expect going forward that know cs mandates perhaps seeing bit less ideal able stem issue bit going forward nnfga perspective'],RBC,"Anke, I'll take this one. I think – and you take the second, Todd. I guess on the exit rate, we are trying to model what the potential will be and I outline that we can definitely converge back into a level of value creation that is in the middle range since maybe it's also appropriate to remember that if we wanted to really reiterate the old story, we would have talked about 15% to 18%. and what we are saying is that we believe the exit rate is 18%. So, I believe that the combined story over time will deliver a better, more stable, less volatile returns and those returns will be in the mid of that range between, you know, from above 15%, around 18%. So, I would say that's the nuances of the changes are the one I just mentioned. So, we are not talking about 15% to 18%. I believe that we are well-positioned to be sustainably in the high teens going forward. I don't think there is a level of being conservative five years ahead. We need to really work out the execution of the phase and understand what is the potential, and over time we will fine tune short-term ambitions.And Anke, on the net new fee generating assets in the quarters, you mentioned they were negative. Just to unpack that a bit. We saw good NNFGA on the UBS platform. What you see a bit is more the Credit Suisse dynamic in terms of mandates on the Credit Suisse platform and in the fact that there was a net outflow of mandates that also could be as well from relationship managers who have left. We are countering that by virtue of having now have an aligned CIO view and aligned solutions and offerings that we're bringing out to both – on both platforms. So, we expect going forward that, you know, the CS mandates that perhaps we were seeing a bit less of than ideal. We should be able to stem that issue a bit going forward from an NNFGA perspective.",['yeah sorry hopefully works talk path 15% 18% 2028 return core tier 1 capital given 15% 18% before conservative timing well 18% compared previous range much self-help versus market second question q4 question net fee generating assets negative q4 maybe elaborate bit whats driving this thank youthank you'],"['Todd Tuckner', 'Sergio P. Ermotti']"
4q23-earnings-call-remarks.pdf,4Q23,"Yeah. Okay. Apologies. Technology is not my specialty. $100 billion net new assets in 2024 and 2025 but that feels like about dividends and interest given the shape of the balance sheet you provide in the slides. So, could you just talk – just expand a little bit on what else the underlying outflows assumptions you're making perhaps on some of the relationships you took over with Credit Suisse whether that's case? And secondly, cash, now 18% of the balance sheet. Very, very high liquidity coverage ratio. Is that something that's just the new run rate or can you bring that down as you complete the complex legal entity restructuring? Thank you.Thank you.",['hey alastair take those so first net new assets know $100 billion next two years reflects fact that know point think making going continue grow asset base mean $100 billion still $100 billion next – next two years $200 billion end 2025 thats focus team terms think know appropriate ambition would be normally growth – full growth mode looking also ensure that know appropriate hygiene balance sheet thats reflecting discount bit still think strong number still growing asset base still providing basis grow revenues highlighted comments reflecting fact addition growing client relationships bringing aligned products solutions clients going situations highlighted where know perhaps see potential outflows decisions made around given service example trying price alone potentially unsuccessfully seeing roll potentially collateral moving bank result so appropriate price this know good necessary work ensure ultimately stronger return rwa sustainably higher returns long run terms cash hqla have yeah could assume going forward structurally run rate given new swiss liquidity ordinance requirements complying with so assume thats right naturally focusing on know winning back deposits continuing diversified sources funding least given structural funding gap inherited credit suisse subsidiary switzerland so know taking steps funding plan narrow that end assume now level liquidity sort run rate level'],Bank of America,"Hey, Alastair, I'll take those. So, on your first on net new assets, you know, the $100 billion over the next two years just reflects the fact that, you know, to the point that I think we've been making that while we're going to continue to grow the asset base, I mean, $100 billion is still $100 billion over the next – each of the next two years, $200 billion by the end of 2025 and that's a focus of the team. In terms of where we think, you know, the appropriate ambition would be, normally when we're just in growth – full growth mode and not looking to also ensure that, you know, appropriate hygiene on the balance sheet, that's reflecting that discount in there a bit. We still think it's a strong number. It's still growing the asset base. It's still providing a basis to grow our revenues, as I highlighted in my comments, but it is reflecting the fact that in addition to growing client relationships and bringing more and more aligned products and solutions to our clients, there are going to be situations, as we both highlighted, where, you know, perhaps we see potential outflows because of decisions we've made around given service for example, trying to a price alone, potentially unsuccessfully, and then seeing that roll off and then potentially the collateral moving out of the bank as a result. So, it's just appropriate to price in some of that as we do this, you know, good and necessary work to ensure ultimately stronger return on RWA and sustainably higher returns in the long run. In terms of cash or the HQLA that we have, yeah, you could assume going forward that that is structurally our run rate for now just given the new Swiss liquidity ordinance requirements that we're complying with. So, you can assume that that's right. Naturally, we're focusing on, you know, winning back deposits and continuing diversified sources of funding, not least given the structural funding gap we've inherited from the Credit Suisse subsidiary in Switzerland. So, you know, we're taking steps in our funding plan to narrow that. But in the end, you can assume that for now, that level of liquidity is sort of run rate level.",['yeah okay apologies technology specialty $100 billion net new assets 2024 2025 feels like dividends interest given shape balance sheet provide slides so could talk – expand little bit else underlying outflows assumptions making perhaps relationships took credit suisse whether thats case secondly cash 18% balance sheet very high liquidity coverage ratio something thats new run rate bring complete complex legal entity restructuring thank youthank you'],['Todd Tuckner']
4q23-earnings-call-remarks.pdf,4Q23,"Hi. Good morning. You hear me well? Okay, perfect. So, my first question goes to GWM Americas. I think the target is low teens until 2026 and then up to mid-teens PBT margin. So, what strategic options are you taking to structurally lift profitability in this division? I think I heard this – rebuilding the banking platform in-house, but if you can give us more color on that. So that's my first longer-term question. Whereas on the short term, in terms of transaction margins, those are being subdued for a while and especially in Asia. What evidence are you seeing or are you seeing any evidence of that coming back? Thank you.Thanks.",['yeah hi giulia so – terms sorts investments making mentioned know think core banking infrastructure work critical effectively institutionalizes clients much effectively that broader suite products capabilities offer clients effect becomes know become stickier clients advisors become stickier know playbook run playbook every part world outside us so something us quite fundamental so going continue continue invest digital capabilities make client advisor us business gwm better also things bring profit margin up sergio mentioned comments lot also products capabilities seeing start hit through thats terms of again borrowing page playbook use outside us global markets approach so joint gwm-investment bank approach serving clients transactional perspective especially clients sophisticated needs also lending perspective well focus lending solutions done outside us well so think think know sort good blocking tackling will know support profit margin mid-teens next two three years terms transaction margins apac yeah think seeing – actually saw good performance fourth quarter trx perspective particular ubs platform encouraging so – also apac again given diversification region limited to know one location potentially underperforming equity markets perspective actually saw good performance region particular saw good performance transactions japan quarter so know good diversified approach ensure even one – said one particular part region generating sorts margins ideal us able compensate'],Morgan Stanley," Yeah. Hi, Giulia. So, on – in terms of the sorts of investments we're making, as you mentioned, you know, we think the core banking infrastructure work is critical because that effectively institutionalizes clients much more effectively in doing that. The more that you have a broader suite of products and capabilities to offer clients, the more in effect it becomes, you know, they become stickier. The clients and the advisors just become stickier. We know that playbook. We run that playbook in every part of the world outside the US. And so, it's something that for us is quite fundamental. And so, we're going to continue to do that and continue to invest in digital capabilities to make being both a client and an advisor of the US business of GWM better. There are also some other things that we're doing to bring that profit margin up. Sergio mentioned in his comments. A lot of it's also about products and capabilities and we're seeing that start to hit through. And that's just in terms of, again, borrowing a page from the playbook that we use outside the US, it's the global markets approach. So, it's having a more joint GWM-Investment Bank approach to serving clients from a transactional perspective, especially clients with more sophisticated needs, also from a lending perspective as well, having more of a focus on lending solutions as we've done outside the US as well. So, I think doing all that is where we think, you know, just doing the sort of good blocking and tackling will, you know, should support the profit margin in mid-teens over the next two to three years. In terms of transaction margins in APAC, yeah, I think we are seeing – we actually saw some good performance in the fourth quarter from a TRX perspective, in particular on the UBS platform, which is encouraging. So, we're – and also in APAC. Again, given just our diversification in the region, we're not just limited to, you know, one location potentially underperforming from an equity markets perspective, and we actually saw a good performance in the region. In particular, we saw good performance in transactions in Japan this quarter. And so, you know, we have the good, diversified approach to ensure that even if one – as I said, one particular part of the region isn't generating the sorts of margins that are ideal for us that we're able to compensate.",['hi good morning hear well okay perfect so first question goes gwm americas think target low teens 2026 mid-teens pbt margin so strategic options taking structurally lift profitability division think heard – rebuilding banking platform in-house give us color that thats first longer-term question whereas short term terms transaction margins subdued especially asia evidence seeing seeing evidence coming back thank youthanks'],['Todd Tuckner']
