filename,Quarter,Question,Question_cleaned,Analyst_Bank,Response,Response_cleaned,Executive
3q23-earnings-call-remarks.pdf,3Q23,"Good morning. Two questions from me, please. Firstly, on the GWM net interest income trajectory. Thank you for the commentary in your prepared remarks. I think you said after a 3% decline in Q3, you expected mid-single-digit percentage decline in Q4 and that there's an ongoing deposit mix shift. So that seems to be accelerating rather than decelerating. So can you give us any indication of how much longer you think that trend could continue for? Do you think now that we're at peak rates, if anything, that should slow as we go into 2024? And also, if there's any implications from your broader deposit pricing that's also influencing that sequential NII decline. That's the first question. Second question, there's been quite a lot of media commentary over the past week ahead of the Too Big To Fail review coming out in spring next year. I think there's been some explicit discussion around potentially introducing more exit fees or more notice periods around deposits. So, anything you could say with regards to that and also what that means for your competitive positioning versus international peers? Thank you.",['yeah thanks andrew first terms gwm nii trajectory think captured right terms guidance around mid-single digit decline owing deposit mix shifts whether seems like acceleration comment think seeing bit broadening dynamic across globe saw 2023 dynamic significantly driven moves sweep deposits higher yielding deposits us saw less europe apac well switzerland seeing us taper now current quarter look ahead seeing bit expansion dynamic parts globe thats whats sort driving that look 2024 work now come back view february view full year 2024 would conclude point saying no see pricing impact mean response current rate environment clients undergoing cash sorting across client baseso respect mentioned changes law regulations around liquidity think say pretty difficult track rumors speculations ideas coming up almost daily swiss media think tell that stage stands even finance minister took official stance matter mean speculations believe going part package think - convinced switzerland keep standards terms allowing – responding crisis march one switzerland broadly speaking following recommendation set fsb bodies sense see us particularly disadvantaged compared jurisdictions terms liquidity ordinance so guess follow think going still take months months full analysis happened translate concrete actions'],Citigroup," Yeah. Thanks, Andrew. On the first in terms of GWM NII trajectory, I think you captured it right in terms of guidance around a mid-single digit decline owing to deposit mix shifts and whether that seems like an acceleration. I'd comment that I think what we're seeing is a bit of a broadening of that dynamic more across the globe. We saw in most of 2023 that dynamic being very significantly driven by moves from sweep deposits into higher yielding deposits in the US. And we saw less of that in Europe and APAC, as well as in Switzerland. And so while we're seeing the US taper now, both in the current quarter and as we look ahead, we're seeing a bit of an expansion of that dynamic in other parts of the globe, and that's what's sort of driving that. As I look out into 2024, we're doing that work now. We'll come back with a view during February with a view on full year 2024. I would just conclude on the point saying, no, I don't see pricing having an impact. I mean, this is just a response to the current rate environment as clients are undergoing cash sorting across our client base.So in respect of what you mentioned and changes in the law or regulations around liquidity. I think I can only say that it's pretty difficult to track all the rumors, speculations and ideas that are coming up, almost daily. On the Swiss media, I think that I can only tell you that, that at this stage what stands is that even the Finance Minister took an official stance on the matter. I mean, those are speculations. I don't believe this is going to be part of the package. I think that - I'm convinced that Switzerland will keep its standards in terms of allowing – or responding to the crisis in March, not only the one in Switzerland, but broadly speaking, with following the recommendation that it will be set by the FSB and other bodies. And in that sense, I don't see us being particularly disadvantaged compared to any other jurisdictions in terms of a Liquidity Ordinance. So, I guess that we will follow up and I think it's going to still take months and months before the full analysis of what happened will translate into concrete actions.",['good morning two questions me please firstly gwm net interest income trajectory thank commentary prepared remarks think said 3% decline q3 expected mid-single-digit percentage decline q4 theres ongoing deposit mix shift seems accelerating rather decelerating give us indication much longer think trend could continue for think peak rates anything slow go 2024 also theres implications broader deposit pricing thats also influencing sequential nii decline thats first question second question theres quite lot media commentary past week ahead big fail review coming spring next year think theres explicit discussion around potentially introducing exit fees notice periods around deposits so anything could say regards also means competitive positioning versus international peers thank you'],"['Todd Tuckner', 'Sergio P. Ermotti']"
3q23-earnings-call-remarks.pdf,3Q23,"Good morning. Thanks for the questions. I had a one big picture question on revenues and then a follow-up on the operational risk RWA. Big picture, your revenues at the minute are annualizing to low-40 billions or so. Clearly, your target has a number, which is probably USD 50 billion-plus. Just want to understand how you see the revenue bridge from here through to 2027 and what the key moving parts should be, particularly in the context of some of your GWM trends, which at the minute seem to be down before we go back up. And then, secondly, on operational risk, I just want to understand some of the assumptions that are going into your Basel IV guidance there. Clearly there's some uncertainty around ILM. There's a bit of uncertainty about what losses to use in that standardized calculation. So what losses from the Credit Suisse business are you having to carry forward and how does that impact your operational risk RWA? And then, finally, can I just clarify on the Basel 3.1 finalization guidance, is that 5% ex. any moves in operational risk? Thank you.Can I ask for a better landing point then?Okay. Thank you.Perfect. Thank you very much.",['thank you adam terms revenues sure ever indicated usd 50 billion plus revenue know figure coming from remember saying back august targets ambitions 2026 based blue sky scenarios revenues so anything guided contrary that definitely focused costs definitely also focusing denominator need basically focus managing utilizing better way resources risk-weighted assets right now go back critical point mission number one last six months foreseeable future restructure credit suisse okay going talk synergies going talk growth but talk growth top line need restructure reset basis sense believe me counting blue sky scenarios figure really figurewell landing point see februaryadam second question terms op risk rwa modeling mentioned initial impact assessment quite dynamic initial discussions regulator point time naturally ahead formal introduction basel iii final op risk rwa therell much extensive interactions regulator agree particulars around ilm say made certain modeled assumptions now well loss history made certain assumptions loss history roll certain legacy matters so thoughtful analysis good initial view going one requires work engagement regulator coming months 5% actually no ex-op risk inclusive given that op risk saying said remarks see broadly unchanged now maths either way'],Mediobanca,"Thank you, Adam. So in terms of revenues, I'm not so sure we ever indicated that we have a USD 50 billion plus revenue. I don't know where this figure is coming from. What I remember saying back in August is that our targets, our ambitions for 2026 are not based on blue sky scenarios on revenues. So, if anything, I guided to the contrary of that. So we are definitely focused on costs and we are definitely also focusing on the denominator. So we need to basically focus on managing and utilizing in a better way the resources and the risk-weighted assets that we have right now. I have to go back to the critical point. Mission number one we have had in the last six months and in the foreseeable future is to restructure Credit Suisse, okay? And then we're going to talk about synergies and then we're going to talk about growth. But, before we talk about growth of the top line, we need to restructure and reset the basis. And in that sense, believe me, we are not counting on blue sky scenarios and that figure is not really our figure.Well, the landing point you will see it in February.Adam, on your second question in terms of op risk RWA and modeling, as I mentioned, we did an initial impact assessment. It was quite dynamic. We've had only initial discussions with our regulator at this point in time, naturally ahead of the formal introduction of Basel III final for op risk RWA, there'll be much more extensive interactions with the regulator to agree on the particulars around the ILM, as you say. We made certain modeled assumptions for now, as well as the loss history. We made certain assumptions about the loss history and the roll off of certain legacy matters. So, it was a thoughtful analysis, a good initial view, but it's going to be one that requires more work and more engagement with our regulator over the coming months. On the 5%, actually, no, it's not ex-op risk, it's inclusive. But given that, op risk we're saying, as I said in my remarks, we see that as broadly unchanged from now. The maths are the same either way.",['good morning thanks questions one big picture question revenues follow-up operational risk rwa big picture revenues minute annualizing low-40 billions so clearly target number probably usd 50 billion-plus want understand see revenue bridge 2027 key moving parts be particularly context gwm trends minute seem go back up then secondly operational risk want understand assumptions going basel iv guidance there clearly theres uncertainty around ilm theres bit uncertainty losses use standardized calculation losses credit suisse business carry forward impact operational risk rwa then finally clarify basel 31 finalization guidance 5% ex moves operational risk thank youcan ask better landing point thenokay thank youperfect thank much'],"['Todd Tuckner', 'Sergio P. Ermotti']"
3q23-earnings-call-remarks.pdf,3Q23,"Yes. Good morning. I'd like to talk about the net new money, especially at CS this quarter, because if I look at extrapolating the quarterly changes in net new money at CS that we've seen over the past two quarters, it seems to point to a run rate where you gain USD 20 to USD 30 billion of net new money per quarter. But then, if I try and reconcile just the month of September from what you had disclosed with Q2, it looks like there's been a slowdown actually in net new money at CS with just USD 2 billion in Wealth this month. So what should I consider as a more normalized level from here? Is it going to be still the pace we saw over quarterly basis or there is a slowdown because the environment is tougher. You probably have visibility there with what happened in October. And the second question is actually following up on this. I know you are going to provide us with the strategic update at the full year, but any hint as to what kind of assumptions you've made in your RoCET1 target towards 2026 regarding the AUM level, especially considering the fact that the market effect is starting for the more negative now. Thank you.",['hi flora thanks questions so net new money credit suisse wealth appreciate fair bit extrapolation math long time business tells extrapolating net new money trends probably necessarily way go certainly know month so point made stabilized business seeing inflows massive outflows us sergio highlighted really objective number one stabilize business achieved look going forward case going reporting metrics combined basis giving indication talked second quarter gave indication even late publication date towards end august so we sergio i wanted follow offer perspective expectation going forward case wealth management manage business providing combined net new money plus dividend interest figure going forward terms rocet1 assumptions terms aum levels work now naturally develop landing zone targets articulated second quarter view growth validating business planning process come back offer specificity around februarythank you'],Jefferies,"Hi, Flora. Thanks for the questions. So, on the net new money for Credit Suisse Wealth, I appreciate your doing a fair bit of the extrapolation math but a long time in this business tells me that extrapolating net new money trends is probably not necessarily the way to go, certainly not from you know, a month or so. The point we've made is that we've stabilized the business. We're seeing inflows after massive outflows and that for us, as Sergio highlighted, was really objective number one, was to stabilize the business and that we've achieved. Look, going forward in any case, we're going to be reporting these metrics on a combined basis. We're just giving an indication because we talked about that in the second quarter. We gave an indication even up to the late publication date towards the end of August. So, we, Sergio and I, wanted to follow through on that and offer that perspective, but the expectation going forward in any case is that Wealth Management, which is how we manage the business, will be providing a combined net new money plus dividend and interest figure going forward. And in terms of the RoCET1 assumptions in terms of AUM levels, we're doing that work now. Naturally, when we develop the landing zone targets that we articulated in the second quarter, we had a view on growth, but now we're validating that in our business planning process and we'll come back and offer specificity around that in February.Thank you.",['yes good morning like talk net new money especially cs quarter look extrapolating quarterly changes net new money cs seen past two quarters seems point run rate gain usd 20 usd 30 billion net new money per quarter then try reconcile month september disclosed q2 looks like theres slowdown actually net new money cs usd 2 billion wealth month consider normalized level here going still pace saw quarterly basis slowdown environment tougher probably visibility happened october second question actually following this know going provide us strategic update full year hint kind assumptions made rocet1 target towards 2026 regarding aum level especially considering fact market effect starting negative now thank you'],"['Todd Tuckner', 'Flora Bocahut']"
3q23-earnings-call-remarks.pdf,3Q23,"Good morning. Thank you. I'd like to ask two questions about non-core, if I could. The first one on the RWA outlook, you've had a great start already reducing that balance down quite effectively. The runoff you show in the slide is effectively the natural runoff with no action, but clearly you are taking action. So, is it reasonable for us to expect that rather than being down 50%, it could be down 75% or 100% within that sort of three-year timeframe? It seems that you're on a more aggressive trajectory than that passive runoff that you're showing in the slide. And then, the second question is also about non-core, about the P&L. So you're annualizing in this quarter around USD 1 billion positive revenues and USD 5 billion of costs. I just wonder is that a representative starting point for us to sort of model non-core going forward? And linked to that, how much could that change in 2024? Could we see – will we still see positive revenues in 2024 in non-core? And how much could we expect the costs to reduce in 2024 in non-core?Okay. Thank you.",['think todd mean let start taking one – know giving mentioned last time give flavor natural decay order understand that leftover case nothing pointed out pretty active said that think reasonable assume going take 100% 75% 100% per se depends terms it critical topic way creates value headlines so get rid probably many positions destroying lot value conflict capital accretion ability us return capital shareholders so think clear framework using think objective number one around non- core necessarily accelerate wind assets take cost thats much critical element freeing capacity resources jeremy p&l question sure revenue side would annualize current quarters revenues revenues function – market would exit positions depends nature positions talking about depends market conditions opportunistic everything sergio said actually informs dynamic speed timing intensity get positions is course governs respect so would put sort target certain extrapolation certainly extrapolation current quarters revenues ncl saying well thats run rate cost side would argue thats different looking – underlying opex looking at point run rate cost support rundown business so business runs down would expect costs associated underlying opex supporting portfolio also run down now may linear expect linear ought somewhere way shape form correlated size balance sheet starts diminish time'],Exane BNP Paribas,"I think, Todd, I mean, let me start with taking the one on – you know we are giving as we mentioned last time, we just give you a flavor for the natural decay in order for you to understand that, what will be the leftover in case we do nothing. And as you pointed out, we have been pretty active. Having said that, I don't think it's reasonable to assume that we're going to take down 100% or 75% to 100% per se because it all depends on at what terms we will do it. The very critical topic here is that we have to do it in a way that creates value and not just headlines. So, we can get rid of probably many of those positions, but destroying a lot of value. And this will be in conflict with capital accretion and the ability for us to return capital to shareholders. So, I think that it's very clear what is the framework we are using and I think objective number one around non- core is not necessarily just to accelerate the wind down of assets, but it's to take down cost. That's the much more critical element of freeing up capacity and resources. And Jeremy, on the P&L question, for sure, on the revenue side, I would not annualize the current quarter's revenues. The revenues are a function of – the market through which we would exit these positions. It depends on the nature of the positions we're talking about. It depends on market conditions. We'll be opportunistic and everything, Sergio just said that actually informs the dynamic about the speed, the timing, the intensity of when we get out of positions is, of course, what governs in that respect. So, I would put no sort of target or certain extrapolation. Certainly, no extrapolation to the current quarter's revenues in NCL is saying, well that's a run rate. On the cost side, I would argue that's different because there you're looking at – on the underlying OpEx, you're looking at, at this point, the run rate cost to support the rundown of the business. So, as that business runs down, you would expect that the costs associated, the underlying OpEx supporting the portfolio will also run down. Now, that may not be linear and I wouldn't expect it to be linear, but it ought to be somewhere in some way, shape or form correlated with the size of the balance sheet as it starts to diminish over time.",['good morning thank you like ask two questions non-core could first one rwa outlook great start already reducing balance quite effectively runoff show slide effectively natural runoff action clearly taking action so reasonable us expect rather 50% could 75% 100% within sort three-year timeframe seems aggressive trajectory passive runoff showing slide then second question also non-core p&l annualizing quarter around usd 1 billion positive revenues usd 5 billion costs wonder representative starting point us sort model non-core going forward linked that much could change 2024 could see – still see positive revenues 2024 non-core much could expect costs reduce 2024 non-coreokay thank you'],"['Todd Tuckner', 'Sergio P. Ermotti']"
3q23-earnings-call-remarks.pdf,3Q23,"Hi. Morning. Thanks for taking my questions. So just turning to tax. Obviously, we saw some nice RWA reduction, but it was negated by the high tax charge. But at the same time, you're talking about mergers of the divisional structure to enable you to reduce the effective tax rate. I was wondering if you could give us more specificity on when we can expect that to happen. And would that be a gradual process for the reduction in the effective tax rate, or would that be actually a step-down change there? And then, my second question is, you've done a good job on costs, well done there. The exit run rates for the end of the year, I was wondering if you could update us on that.That’s great. Thank you.",['thanks andrew so tax question terms timing mentioned remarks certainly elevated tax rate function fact expenses weighing pre-tax moment particular integration related expenses incurred jurisdictions able offset – even within jurisdictions - necessarily offset profits losses different entities given fall out could expenses losses one entity thats tax grouped entity generating taxable profits thats indeed whats happening really across globe credit suisse entities particular appreciate credit suisse ag yet merged ubs ag separate chains entities so therefore anything happening cs ag side would otherwise ideally shelter profits ubs side happening start mergers now that question was step gradual see both mean certainly see immediate benefits bringing together certain entities others going harder work harder planning unlock additional tax value get rate lower level you’ll see mergers take place course 2024 see step down also said gradually see rate come back in terms update year end say third quarter see run rate saves excess usd 3 billion expect make progress undertaking actions present quantified that expect progress fourth quarter exit 2023'],Société Générale,"Thanks, Andrew. So, on the tax question, in terms of timing. As I mentioned in my remarks, certainly the elevated tax rate is a function of the fact that the expenses that are weighing on our pre-tax at the moment, in particular, the integration related expenses are being incurred in jurisdictions where we're not able to offset – even within the jurisdictions - necessarily offset profits and losses in different entities just given where they fall out. So there could be expenses or losses in one entity that's not tax grouped with an entity that is generating taxable profits. And that's indeed what's happening really across the globe because the Credit Suisse entities in particular, as you'll appreciate under Credit Suisse AG, which is not yet merged with UBS AG, those are separate chains of entities. So, therefore, anything happening on the CS AG side that you would otherwise ideally shelter with profits of the UBS side, isn't happening until we start the mergers. Now, once we do that, your question was, is it a step or it's gradual? We'll see both. I mean, certainly we'll see some immediate benefits by bringing together certain entities. Others are going to be harder work and harder planning to unlock some additional tax value and get the rate to a lower level. So you’ll see once the mergers take place over the course of 2024, you'll see some step down. But you'll also, as I said, gradually see the rate come back in. In terms of the update for year end, we did say that as of the third quarter, we see the run rate saves in excess of USD 3 billion and expect to make further progress. We're undertaking actions at present. We haven't quantified that, but you can expect that there will be further progress in the fourth quarter before we exit 2023.",['hi morning thanks taking questions turning tax obviously saw nice rwa reduction negated high tax charge time talking mergers divisional structure enable reduce effective tax rate wondering could give us specificity expect happen would gradual process reduction effective tax rate would actually step-down change there then second question is done good job costs well done there exit run rates end year wondering could update us thatthat’s great thank you'],['Todd Tuckner']
