filename,Quarter,Question,Question_cleaned,Analyst_Bank,Response,Response_cleaned,Executive
2q23-earnings-call-remarks.pdf,2Q23,"Good morning. Thank you very much for all the information. There's a lot to get through and a lot of questions. I'll just ask two things. One is, could you talk about the Swiss integration, which obviously takes time and I think you said it's going to legally close in 2024 and then physically integrate in 2025. I just wondered, you know, what determines that timeframe and how you manage? How you intend to keep the businesses stable whilst they're in that slight sort of limbo period. So that's my first question. And the second question is about sort of capital stack. The 14% CET1 target I imagine it implies that you're going to reissue AT1 and rebuild the AT1 part of your capital stack. And I saw a headline the other day that you might even do that this autumn. I just wondered if you could comment on that aspect, your intentions in terms of issuing AT1. Thank you.",['thank you jeremy so well first all integration course know go through mentioned important understand sequence going go merger different legal entities know we mentioned before intention merge two parent company ubs ag credit suisse ag follow-through different entities underneath go process so need optimize timing different aspects last least also one regulatory approvals so starting process terms swiss business know way manage by mentioned first all assuring people employed swiss businesses ubs credit suisse subject redundancies end 2024 so whats important message clients nothing changes view make smooth clients go transition go kind legal process regulatory process merging two entities time also tackling migration operational migration something completed early 2025 so we message balance showing way forward people clients without rush stable manner people you clients continue served way expect served terms cet1 target well course at1 continues important element capital stack strategy comment speculations watching market carefully assess timing need tapping markets appropriate but yes course looking at1 markets make consideration appropriate'],Exane BNP Paribas,"Thank you, Jeremy. So, well, first of all, on the integration, of course, you know, now that we go through, as I mentioned, it's very important to understand the sequence of how we're going to go through the merger of the different legal entities. You know, we, as I mentioned before, our intention is to merge the two parent company, UBS AG and Credit Suisse AG. And as a follow-through different entities underneath will go through the same process. So, we need to optimize the timing from different aspects. And last but not least, also one of regulatory approvals. So, we are starting now the process to do that in terms of the Swiss business. You know, the way we will manage that is by, as I mentioned, first of all, assuring that all people employed in the Swiss businesses at UBS and Credit Suisse will not be subject to any redundancies until the end of 2024. So, what's the most important message is to clients, that nothing changes for them and our view is to make it very smooth for clients to go through the transition. And so once we go through this kind of legal process and regulatory process of merging the two entities, at the same time, we are also tackling the IT migration, the operational migration. And this is something that will only be completed early on in 2025. So, what we, the message here is a balance between showing the way forward to our people, to clients, but without rush and in a stable manner. So that people you, our clients continue to be served in the way they expect to be served. In terms of the CET1 target, well, of course, AT1 continues to be an important element of our capital stack and strategy. I will not comment on speculations. We are watching the market carefully, we will assess the timing and the need of tapping the markets when appropriate. But, yes of course we are looking at the AT1 markets and we will make our consideration when appropriate.",['good morning thank much information theres lot get lot questions ask two things one is could talk swiss integration obviously takes time think said going legally close 2024 physically integrate 2025 wondered know determines timeframe manage intend keep businesses stable whilst slight sort limbo period thats first question second question sort capital stack 14% cet1 target imagine implies going reissue at1 rebuild at1 part capital stack saw headline day might even autumn wondered could comment aspect intentions terms issuing at1 thank you'],['Sergio P. Ermotti']
2q23-earnings-call-remarks.pdf,2Q23,"Yes. Thank you. It's Alastair, BofA. Sergio, good morning. Great to have clarity on the strategy and obviously the market is delighted as you are that the flows have come back. Just then on operating costs. Very clear ambitions and it looks like you're bringing forward a little 2027 to 2026 when you've landed everything. But just given the size of the operating costs in the old Credit Suisse investment bank and non-core, can you give us any sense about how quickly you can go there? So the quite a large restructuring charge, integration charge in the second half, but does that cost number move out quickly so that you normalize profitability or is there still quite a long, long tail to the cost in that part of the business? It's just, you know, IB classic, the revenues have gone, the costs are still lingering and how quickly they go? Thank you.",['hi alastair yeah terms speed expect take cost sergio said operating pace terms cost takeout among top priorities terms particular restructuring parts credit suisse need immediate attention restructuring see making strong progress gate terms cost takeout second half 2023 cost achieve cost takeout well obviously modeled get targets – landing zones described earlier terms returns cost-to-income ratio end 2026 say costs long tail cases thats complexity operation unpack significant infrastructure technology; large array legal entities thousand legal entities addressed back one proof point software components 3000 applications work team done suggests integrate 300 ubs takes time so yes long tail count us operate quickly last thing would say terms clarity sense things hit through give degree clarity second half year give sort landing zone come back clarity business planning process second half yearand fourth quarter earnings early february would probably complement todd’s observation because important de facto vast majority assets non-core legacy supported credit suisse ib platform so progress winding the call it core day-to-day operation front office stand point view whatever left going legacy infrastructure ib infrastructure non-core see important element determining quickly get rid non-core assets consequence that accelerate winding operation think thats exactly working give detail early next year present q4 results three year plan'],Bank of America Merrill Lynch,"Hi, Alastair. Yeah. In terms of the speed at which we expect to take out cost. As Sergio and I said, we've been operating at pace in terms of the cost takeout which is among our top priorities. In terms of in particular restructuring the parts of Credit Suisse that need immediate attention and restructuring. And so you see how we're making very strong progress out of the gate in terms of the cost takeout through the second half of 2023 and the cost to achieve those cost takeout as well. We've obviously modeled to get to the targets that – or the landing zones that we described earlier in terms of returns and the cost-to-income ratio at the end of 2026. But as you say, the costs do have a long tail in some cases, and that's because of the complexity of the operation that we have to unpack. Because you have significant infrastructure and technology; you have a very large array of legal entities, over a thousand legal entities, that have to be addressed. And just back one proof point on the software components, there are 3,000 applications and the work that our team has done suggests that we will only integrate 300 into UBS. That takes time. And so, yes, there is a long tail, but you can count on us to operate quickly. The last thing I would say is in terms of clarity on a sense of as those things hit through, because we give a degree of clarity through the second half of the year and we give sort of that landing zone, we will come back with further clarity once we do the business planning process in the second half of the year.And that will be with our fourth quarter earnings in early February. And I would probably complement Todd’s observation. Because, it is very important that de facto the vast majority of the assets are in non-core and legacy are supported by the Credit Suisse IB platform. So, as we progress in winding down the, call it, core day-to-day operation from the front office stand point of view. Whatever is left is going to be legacy infrastructure, IB infrastructure, that is only there for non-core. And so you can see out then this will be a very important element in determining how quickly we get rid of non-core assets. Because as a consequence of that, we accelerate the winding down of this operation. But I think that's exactly what we are working on and we will give you more detail early on next year when we present our Q4 results and our three year plan.",['yes thank you alastair bofa sergio good morning great clarity strategy obviously market delighted flows come back operating costs clear ambitions looks like bringing forward little 2027 2026 landed everything given size operating costs old credit suisse investment bank non-core give us sense quickly go there quite large restructuring charge integration charge second half cost number move quickly normalize profitability still quite long long tail cost part business just know ib classic revenues gone costs still lingering quickly go thank you'],"['Todd Tuckner', 'Sergio P. Ermotti']"
2q23-earnings-call-remarks.pdf,2Q23,"Good morning, everybody. And thanks for taking my questions. Just two for me. First, in Wealth Management, you've talked about now essentially being at scale in every growth market globally. But in tangible terms, what does that enhanced scale enable you to do that perhaps you weren't able to do previously? And have you seen any proactive response from competitors in reaction to that enhanced scale? That's my first question. And then second, looking at the banking business in Switzerland. Now the dust has settled, does all the volatility we saw earlier in the year changed at all how you think strategically about running the combined Swiss bank be it in terms of capital, funding, liquidity, etc.? I guess just sort of simply has your risk appetite changed in Switzerland?",['thank you so  look terms scale course economy scale so able leverage ubss platform onboard assets huge advantage have call it marginal costs effects also look geographic footprint two operations extremely complementary areas relationships also geographical terms ie example brazil right so lot operation credit suisse much stronger create important player asia really reinforced position north asia southeast asia think switzerland quite clear also across europe different markets know ideally fragmented market general wealth management particularly europe there create economies scales things would able fund organic standpoint view so important mentioned also credit suisse across board asset management wealth management brings capabilities excellent products leveraged our ubs client franchise seen competitors mean reaction competitors course started take advantage fragile situation credit suisse already 2022 late 2022 course beginning year pretty normal situation so said that think saw flows clients comfortable understand value added franchise able retain actually re-attract back clients so turn proactive spare effort regain back lost assets so terms swiss anything anything changing mean important reiterate nothing changes way run swiss businesses fully integrated right so client point view service risk capital allocation nothing changes even merged commitment said remarks continue sustain combined lending book course exceptional risky situations principle clear one one makes two want keep market share switzerland switzerland strategic absolutely strategic group want lose market share today'],Goldman Sachs,"Thank you. So, , look, in terms of scale, of course, there is an economy of scale. So, being able to leverage UBS's IT platform as we onboard all the assets. It's a huge advantage because we have, call it, marginal costs effects. But also when you look at the geographic footprint of the two operations, they are extremely complementary in some areas by relationships, but also in geographical terms, i.e. for example, in Brazil, right. So, we had a we had a lot of operation, Credit Suisse is much stronger, we now create a very important player. In Asia we've really reinforced our position and both in North Asia and Southeast Asia. I think that in Switzerland its quite clear, And also across Europe where there are different markets where you know ideally it's a very fragmented market in general, wealth management, particularly in Europe. So there, we create economies of scales and things that we would have not been able to fund from our organic standpoint of view. So, it's very important. As I mentioned before also Credit Suisse across the board, in asset management, in wealth management brings capabilities and excellent products that can be then leveraged into our, into the UBS client franchise. And we've seen the competitors. I mean the reaction of competitors, of course, they started to take advantage of the fragile situation of Credit Suisse already during 2022, late 2022, of course, at the beginning of the year. And it's a pretty normal situation so. Now having said that, I think that as you saw from the flows, clients are now comfortable and they understand the value added of the franchise, we are able to retain and actually re-attract back clients. So, now it's our turn to be proactive and we will not spare any effort to regain back any lost assets. So, in terms of the Swiss has anything, is anything changing? I mean, it's very important to reiterate that nothing changes in the way we run our Swiss businesses until they are fully integrated, right? So, from a client point of view, and in service, and in risk, and capital allocation, nothing changes. And even after we merged, our commitment, as I said in my remarks, is that we will continue to sustain the combined lending book. Of course, there are exceptional risky situations, but our principle is very clear. One and one makes two. We want to keep our market share in Switzerland. Switzerland is strategic, absolutely strategic for the Group, and we will not want to lose any of the market share we have today.",['good morning everybody thanks taking questions two me first wealth management talked essentially scale every growth market globally tangible terms enhanced scale enable perhaps able previously seen proactive response competitors reaction enhanced scale thats first question second looking banking business switzerland dust settled volatility saw earlier year changed think strategically running combined swiss bank terms capital funding liquidity etc guess sort simply risk appetite changed switzerland'],['Sergio P. Ermotti']
2q23-earnings-call-remarks.pdf,2Q23,"Morgan Yeah, good morning, Sergio and Todd. Thanks for taking my questions. First question is on risk weighted assets. You have around USD 557 billion, USD 145 billion operational risk weighted assets. And I'm just wondering how we should think about the exit run rates in 2026 in terms of total risk weighted assets as well as in terms of operational risk weighted assets if I may. And then the second question is related to the non- core. Could you talk a little bit about the P&L effects of the non-core ex any more active write-downs or sales, so to say, leading to potential write-downs? I'm just trying to understand the P&L in terms of run rate of the noncore legacy bank, if I may. Thank you.Morgan Okay. Thank you. If I may just very briefly on the risk weighted assets, if I – to take a very simplistic view and I just assume. I know the runoff, I can make some assumptions about Basel IV then op risk which is clearly very difficult to predict if I want to be conservative. One could assume that ultimately the risk weighted assets conservatively could not grow if at all to materially decline?",['hi kian terms op risk rwa come back next quarter fair bit additional modeling terms op risk rwa combined bank started initial views initial discussions regulators informed 10 billion reduction spoke comments then terms trajectory think 557 towards 2026 color complete business planning process 3 ysp come back early next year mentioned terms of asked p&l run rate non-core so would say is first off thing thats important take costs focus significantly cost takeout theres significant level overhead costs associated wind portfolio so way think emphasized far today take costs effectively costs sit parts credit suisse work so costs whether personnel costs whether technology costs real estate costs move non-core legacy support core businesses run extremely quickly so would say first foremost cost way think cost rundown integration timeline theres asset rundown talked trajectory natural rundown perspective course sergio mentioned strategically actively looking that course perspective taken ppa adjustments excess usd 5 billion relating non-core legacy think thats useful way think too fact pulls par fair value positions manage book capital efficient way dispose positions appropriate also keeping considering funding costs costs operations technology people etckian its know cant really comment right now modeling really going details plan need really also go exercise sure appreciate put together legal entities optimization that fairly complex operation so go territory projecting risk-weighted assets going forward one two elements – well three elements starting point good starting point know make adjustments next three four months op risk one subjects need go through first all efficiencies take run assets yes efficiency optimizing legal entity operations growth remember going grow well attach also prospect equation go much risk-weighted assets projection see tell q3 q4 q4 results'],JP,"Hi Kian. In terms of the op risk RWA, we will come back next quarter after doing a fair bit of additional modeling in terms of the op risk RWA of the combined bank. We've started to have initial views on that and initial discussions with our regulators and that informed the 10 billion reduction that I spoke about in my comments. And then, in terms of the trajectory and how we think about the 5.57 towards 2026, you'll have more color on that after we complete the business planning process and our 3 YSP and come back early next year as mentioned. In terms of, you asked about the P&L and the run rate in non-core. So, what I would say on that is. So first off, the thing that's most important is to take costs out and to focus very significantly on the cost takeout because there's a significant level of overhead and costs that aren't associated with the wind down of the portfolio. So, the way to think about it is that we have emphasized so far today that we have to take costs out and effectively, the costs that sit in parts of Credit Suisse that don't work. And so, those costs, whether they be personnel costs or whether they be technology costs or real estate costs, they move into non-core and legacy if they don't support the core businesses and they have to be run down extremely quickly. And so, I would say, first and foremost, it's a cost. The way to think about it is the cost rundown over the integration timeline. Then there's the asset rundown and we talked about the trajectory from a natural rundown perspective. And of course as Sergio mentioned that there will be strategically and actively looking at that. And of course from that perspective, we have taken some PPA adjustments in excess of USD 5 billion relating to non-core and legacy. I think that's a useful way to think about it too, the fact that some of that pulls to par and some of that will be fair value positions. And we will manage that book in the most capital efficient way that we can and dispose of positions as appropriate. And also keeping just considering funding costs and the costs of operations, technology, people, etc.Kian, its, you know, we can't really comment right now. We are modeling. We are really going through the details of the plan. We need to really also go through the exercise. I'm sure you appreciate when we put together legal entities, the optimization of all that, it's a fairly complex operation. So, I wouldn't go into a territory of projecting risk-weighted assets going forward because one, there are two elements – well, three elements. The starting point is a good starting point. We know that we can make some adjustments in the next three to four months. Op risk was one of these subjects. But then you need to go through, first of all, what are the efficiencies we take out as we run down assets. Yes. What are the efficiency on optimizing legal entity operations? And then what is the growth? Because remember, we are going to grow, as well. And we have to attach also that prospect into the equation. I wouldn't go into too much of a risk-weighted assets projection until you see what we tell you in Q3 and Q4, for the Q4 results.",['morgan yeah good morning sergio todd thanks taking questions first question risk weighted assets around usd 557 billion usd 145 billion operational risk weighted assets wondering think exit run rates 2026 terms total risk weighted assets well terms operational risk weighted assets may second question related non- core could talk little bit p&l effects non-core ex active write-downs sales say leading potential write-downs trying understand p&l terms run rate noncore legacy bank may thank youmorgan okay thank you may briefly risk weighted assets – take simplistic view assume know runoff make assumptions basel iv op risk clearly difficult predict want conservative one could assume ultimately risk weighted assets conservatively could grow materially decline'],"['Todd Tuckner', 'Sergio P. Ermotti']"
